date,verse_title,cosine_score,phrase_woodruff,phrase_scripture,volume_title
"April 30, 1878 ",1 Chronicles 6:58,0.74747,was with her in the morning and administered to her with me He,And Hilen with her suburbs Debir with her suburbs,Old Testament
"April 30, 1843 ",John 3:5,0.74632,and the spirit you cannot enter into the kingdom of God saith the,of water and of the Spirit he cannot enter into the kingdom of God,New Testament
"January 1, 1853 ",Doctrine and Covenants 132:19,0.74576,they should come forth in the morning of the first Resurrection and be,come forth in the first resurrection and if it be after the first,Doctrine and Covenants
"August 27, 1844 ",Doctrine and Covenants 6:8,0.74553,shall be the means of doing much good for you shall have the,it shall be unto you and if you desire you shall be the means of doing much good in this generation,Doctrine and Covenants
"April 15, 1837 ",Doctrine and Covenants 28:15,0.74453,thee Thou shalt have long life and see good days Thou shalt be,And it shall be given thee from the time thou shalt go until the time thou shalt return what thou shalt do,Doctrine and Covenants
"August 20, 1843 ",Revelation 20:9,0.74423,Camp of the Saints and the Beloved City and fire came down from,camp of the saints about and the beloved city and fire came down from God out of heaven and devoured them,New Testament
"August 5, 1838 ",Doctrine and Covenants 63:58,0.74417,it to be a day of warning and not of many words this,For this is a day of warning and not a day of many,Doctrine and Covenants
"November 15, 1896 ",Zechariah 12:10,0.74413,I will pour out upon you and the inhabitants of Zion and the,And I will pour upon the house of David and upon the inhabitants,Old Testament
"January 1, 1877 ",Doctrine and Covenants 133:27,0.74404,May the highway spedily be cast up in the midst of the great,And an highway shall be cast up in the midst of the great deep,Doctrine and Covenants
"June 1, 1843 ",1 Thessalonians 5:28,0.74307,the grace of Jesus Christ our Lord be and abide with you all,The grace of our Lord Jesus Christ be with you Amen,New Testament
"October 8, 1867 ",Doctrine and Covenants 136:2,0.74235,Snow The Authorities of the Church of Jesus Christ of Latterday Saints were,Let all the people of The Church of Jesus Christ of Latterday Saints,Doctrine and Covenants
"April 15, 1837 ",Luke 4:8,0.74225,Thou shalt labour in the Temple of the Lord thy God Thou shalt,it is written Thou shalt worship the Lord thy God and him only shalt thou serve,New Testament
"March 10, 1844 ",Moses 7:10,0.74214,to the Fathers lest I come and smite the earth with a curse,themRepent lest I come out and smite them with a curse and they die,Pearl of Great Price
"January 9, 1894 ",Mark 13:31,0.74207,all be fulfilled And though heaven and earth pass away my words shall,Heaven and earth shall pass away but my words shall not pass away,New Testament
"January 9, 1894 ",Matthew 24:35,0.74207,all be fulfilled And though heaven and earth pass away my words shall,Heaven and earth shall pass away but my words shall not pass away,New Testament
"January 9, 1894 ",Luke 21:33,0.74207,all be fulfilled And though heaven and earth pass away my words shall,Heaven and earth shall pass away but my words shall not pass away,New Testament
"December 16, 1857 ",Numbers 14:14,0.74084,pillar of fire by night and a cloud by day And the way,thou goest before them by day time in a pillar of a cloud and in a pillar of fire by night,Old Testament
"February 26, 1879 ",Doctrine and Covenants 133:31,0.74021,of the everlasting Hills shall tremble at your presence And you shall fall,And the boundaries of the everlasting hills shall tremble at their presence,Doctrine and Covenants
"April 30, 1878 ",1 Chronicles 6:68,0.74017,was with her in the morning and administered to her with me He,And Jokmeam with her suburbs and Bethhoron with her suburbs,Old Testament
"April 30, 1878 ",Joshua 21:15,0.74017,was with her in the morning and administered to her with me He,And Holon with her suburbs and Debir with her suburbs,Old Testament
"April 30, 1878 ",Joshua 21:14,0.74017,was with her in the morning and administered to her with me He,And Jattir with her suburbs and Eshtemoa with her suburbs,Old Testament
"April 30, 1878 ",1 Chronicles 6:73,0.74017,was with her in the morning and administered to her with me He,And Ramoth with her suburbs and Anem with her suburbs,Old Testament
"April 30, 1878 ",1 Chronicles 6:81,0.74017,was with her in the morning and administered to her with me He,And Heshbon with her suburbs and Jazer with her suburbs,Old Testament
"April 30, 1878 ",1 Chronicles 6:75,0.74017,was with her in the morning and administered to her with me He,And Hukok with her suburbs and Rehob with her suburbs,Old Testament
"April 30, 1878 ",1 Chronicles 6:59,0.74017,was with her in the morning and administered to her with me He,And Ashan with her suburbs and Bethshemesh with her suburbs,Old Testament
"April 30, 1878 ",1 Chronicles 6:69,0.74017,was with her in the morning and administered to her with me He,And Aijalon with her suburbs and Gathrimmon with her suburbs,Old Testament
"October 6, 1891 ",Doctrine and Covenants 124:118,0.74002,Saints will hearken unto my voice and the counsel of my Servants the,And hearken unto the counsel of my servants Joseph and Hyrum and William,Doctrine and Covenants
"October 2, 1840 ",Doctrine and Covenants 76:6,0.73944,given unto the[e] and great shall be thy reward and eternal shall be,Great shall be their reward and eternal shall be their glory,Doctrine and Covenants
"October 21, 1855 ",Isaiah 40:9,0.73939,the[e] up into the High mountains that bringest good tidings we say that,O Zion that bringest good tidings get thee up into the high mountain,Old Testament
"August 20, 1843 ",Doctrine and Covenants 5:22,0.73913,grant unto you eternal life if you should be slain Page 126 1,you and if you do this behold I grant unto you eternal life even if you should be slain,Doctrine and Covenants
"October 18, 1848 ",Doctrine and Covenants 38:6,0.73894,its flight from Gentile America and wo wo wo is their DOOM The,not hear my voice but harden their hearts and wo wo wo is their doom,Doctrine and Covenants
"August 25, 1896 ",Jeremiah 17:20,0.73879,Son of Man Again hear ye the word of the Lord O ye,And say unto them Hear ye the word of the Lord ye kings,Old Testament
"December 31, 1870 ",Doctrine and Covenants 138:53,0.7379,to the Prophet Joseph Smith Jr 5 to Hyrum Smith 4 to Father,The Prophet Joseph Smith and my father Hyrum Smith Brigham Young John Taylor,Doctrine and Covenants
"October 21, 1855 ",Doctrine and Covenants 88:95,0.73783,can loose them then shall the curtain of Heaven be unfolded as a,hour and immediately after shall the curtain of heaven be unfolded as a,Doctrine and Covenants
"August 20, 1843 ",Revelation 16:3,0.73782,ch 3 v that he poured out his vial upon the sea and,And the second angel poured out his vial upon the sea and it,New Testament
"June 5, 1837 ",Doctrine and Covenants 136:2,0.73772,the Church of Jesus Christ of Latterday Saints had it not been for,Let all the people of The Church of Jesus Christ of Latterday Saints,Doctrine and Covenants
"April 7, 1844 ",Doctrine and Covenants 138:48,0.73769,and our dead for the fulness of the dispensation of times A dispensation,in the dispensation of the fulness of times for the redemption of the,Doctrine and Covenants
"April 30, 1854 ",2 Nephi 15:5,0.73767,will now tell this people what they should do I will tell the,And now go to I will tell you what I will do to,Book of Mormon
"April 30, 1854 ",Isaiah 5:5,0.73767,will now tell this people what they should do I will tell the,And now go to I will tell you what I will do to,Old Testament
"January 21, 1847 ",Deuteronomy 1:15,0.73758,Captains of Hundreds Captains of Fifties and Captains of Tens with a President,made them heads over you captains over thousands and captains over hundreds and captains over fifties and captains over tens and officers among your tribes,Old Testament
"January 21, 1847 ",Doctrine and Covenants 136:15,0.73706,Captains of Hundreds Captains of Fifties and Captains of Tens with a President,And appoint presidents and captains of hundreds and of fifties and of tens,Doctrine and Covenants
"December 1, 1885 ",Doctrine and Covenants 124:102,0.73669,my servant John Taylor 1808 and my servant Wilford Woodruff and my servant,servant William and my servant Hyrum and for them alone and let my,Doctrine and Covenants
"January 4, 1852 ",1 John 5:16,0.73656,is not unto death their is a sin unto death which we were,sin not unto death There is a sin unto death I do not say that he shall pray for it,New Testament
"April 11, 1893 ",Doctrine and Covenants 124:22,0.73651,the Lord unto my servant John Taylor 1808 and my servant Wilford Woodruff,Let my servant George and my servant Lyman and my servant John Snider,Doctrine and Covenants
"January 21, 1847 ",Doctrine and Covenants 136:31,0.73635,that I have for them even the glory of Zion And he that,to receive the glory that I have for them even the glory of,Doctrine and Covenants
"June 25, 1843 ",Doctrine and Covenants 128:16,0.7356,Apostle said why then are ye baptized for the dead if the dead,which are baptized for the dead if the dead rise not at all Why are they then baptized for the dead,Doctrine and Covenants
"March 27, 1842 ",Doctrine and Covenants 68:8,0.73554,the Name of the Father of the Son and of the Holy Ghost,in the authority which I have given you baptizing in the name of the Father and of the Son and of the Holy Ghost,Doctrine and Covenants
"February 26, 1879 ",John 13:17,0.73517,ye Latter Day Saints do ye not know these things are true You,If ye know these things happy are ye if ye do them,New Testament
"October 6, 1891 ",Doctrine and Covenants 124:45,0.73497,Saints will hearken unto my voice and the counsel of my Servants the,And if my people will hearken unto my voice and unto the voice,Doctrine and Covenants
"April 15, 1837 ",Romans 13:9,0.73494,Thou shalt labour in the Temple of the Lord thy God Thou shalt,For this Thou shalt not commit adultery Thou shalt not kill Thou shalt,New Testament
"December 19, 1885 ",2 Chronicles 6:30,0.7346,no man as thou knowest for thou knowest all our ways Thou hast,every man according unto all his ways whose heart thou knowest for thou only knowest the hearts of the children of men,Old Testament
"October 20, 1896 ",Haggai 2:9,0.73367,saith the Lord of hosts As I the Lord have suffered so will,saith the Lord of hosts and in this place will I give peace saith the Lord of hosts,Old Testament
"February 2, 1851 ",Moses 7:10,0.73352,the children lest I come and smite the whole Earth with a curse,themRepent lest I come out and smite them with a curse and they die,Pearl of Great Price
"February 26, 1879 ",Romans 8:17,0.73328,and heirs of God and Joint heirs of Jesus Christ to a fulness,And if children then heirs heirs of God and jointheirs with Christ if,New Testament
"February 12, 1862 ",Doctrine and Covenants 107:55,0.73222,thee to be at the Head a multitude of Nations shall come of,set thee to be at the head a multitude of nations shall come of thee and thou art a prince over them forever,Doctrine and Covenants
"October 18, 1848 ",3 Nephi 9:2,0.73202,its flight from Gentile America and wo wo wo is their DOOM The,Wo wo wo unto this people wo unto the inhabitants of the whole,Book of Mormon
"April 15, 1837 ",Ezekiel 38:8,0.73182,thee Thou shalt have long life and see good days Thou shalt be,After many days thou shalt be visited in the latter years thou shalt,Old Testament
"July 28, 1860 ",3 Nephi 9:15,0.73126,Now Jesus said I am in the Father and the Father in me,the Father from the beginning I am in the Father and the Father in me and in me hath the Father glorified his name,Book of Mormon
"April 30, 1861 ",Doctrine and Covenants 87:3,0.73099,Northern States and the Northern States against the Southern States and that war,For behold the Southern States shall be divided against the Northern States and,Doctrine and Covenants
"January 13, 1856 ",Malachi 4:6,0.73058,"lest I come and smite the Earth with a curse"" Abram received the",the heart of the children to their fathers lest I come and smite the earth with a curse,Old Testament
"January 13, 1856 ",3 Nephi 25:6,0.73058,"lest I come and smite the Earth with a curse"" Abram received the",the heart of the children to their fathers lest I come and smite the earth with a curse,Book of Mormon
"October 7, 1867 ",Doctrine and Covenants 135:6,0.73039,To learn the Bible Book of Mormon and Doctrine and Covenants and all,the Book of Mormon and this book of Doctrine and Covenants of the,Doctrine and Covenants
"February 18, 1855 ",Doctrine and Covenants 1:31,0.73002,that we may not look upon sin with any degree of allowance of,For I the Lord cannot look upon sin with the least degree of allowance,Doctrine and Covenants
"December 31, 1849 ",Isaiah 65:21,0.72946,Houses and inhabit them plant vineyards and eat the fruit thereof I Pray,And they shall build houses and inhabit them and they shall plant vineyards and eat the fruit of them,Old Testament
"August 27, 1844 ",Doctrine and Covenants 11:8,0.72938,shall be the means of doing much good for you shall have the,it shall be done unto you and if you desire you shall be the means of doing much good in this generation,Doctrine and Covenants
"March 10, 1844 ",Luke 3:4,0.72904,the wilderness prepare ye the way of the Lord and make his paths,prophet saying The voice of one crying in the wilderness Prepare ye the way of the Lord make his paths straight,New Testament
"April 4, 1896 ",Zechariah 1:3,0.72843,Saith the Lord of hosts I the Lord have spoken and will be,unto me saith the Lord of hosts and I will turn unto you saith the Lord of hosts,Old Testament
"March 27, 1842 ",Moses 7:11,0.72833,the Name of the Father of the Son and of the Holy Ghost,and truth and of the Holy Ghost which beareth record of the Father and the Son,Pearl of Great Price
"April 30, 1861 ",2 Nephi 6:13,0.72808,they will be glad to lick up the dust of the feet of,shall lick up the dust of their feet and the people of the,Book of Mormon
"September 10, 1843 ",Luke 21:24,0.72788,be trodden down of the gentiles until the times of the gentiles be,led away captive into all nations and Jerusalem shall be trodden down of the Gentiles until the times of the Gentiles be fulfilled,New Testament
"September 5, 1841 ",Doctrine and Covenants 20:77,0.72787,AMEN O GOD THE Eternal Father I ASK THE IN THE NAME OF,O God the Eternal Father we ask thee in the name of thy,Doctrine and Covenants
"September 5, 1841 ",Moroni 5:2,0.72787,AMEN O GOD THE Eternal Father I ASK THE IN THE NAME OF,O God the Eternal Father we ask thee in the name of thy,Book of Mormon
"September 5, 1841 ",Doctrine and Covenants 20:79,0.72787,AMEN O GOD THE Eternal Father I ASK THE IN THE NAME OF,O God the Eternal Father we ask thee in the name of thy,Doctrine and Covenants
"September 5, 1841 ",Moroni 4:3,0.72787,AMEN O GOD THE Eternal Father I ASK THE IN THE NAME OF,O God the Eternal Father we ask thee in the name of thy,Book of Mormon
"June 30, 1893 ",Doctrine and Covenants 124:45,0.72774,they will hearken unto my voice and do as I command them The,And if my people will hearken unto my voice and unto the voice,Doctrine and Covenants
"June 24, 1845 ",Doctrine and Covenants 136:2,0.72754,the Bishop of the Church of Jesus Christ of Latterday Saints in Clay,Let all the people of The Church of Jesus Christ of Latterday Saints,Doctrine and Covenants
"December 20, 1850 ",Genesis 26:3,0.72708,thee and reveal unto thee thy duty yea and give unto thee many,thee for unto thee and unto thy seed I will give all these,Old Testament
"February 2, 1851 ",Doctrine and Covenants 110:15,0.72707,turn the hearts of the children to their fathers and the fathers to,To turn the hearts of the fathers to the children and the children to the fathers lest the whole earth be smitten with a curse,Doctrine and Covenants
"June 25, 1886 ",Doctrine and Covenants 76:10,0.72682,seen nor Ear heard Neither hath it Entered into the heart of Man,which eye has not seen nor ear heard nor yet entered into the heart of man,Doctrine and Covenants
"March 4, 1842 ",Isaiah 9:6,0.72611,minutes past 10 oclock unto us a child is given! unto us a,For unto us a child is born unto us a son is given,Old Testament
"March 4, 1842 ",2 Nephi 19:6,0.72611,minutes past 10 oclock unto us a child is given! unto us a,For unto us a child is born unto us a son is given,Book of Mormon
"December 20, 1850 ",Genesis 17:8,0.72585,thee and reveal unto thee thy duty yea and give unto thee many,And I will give unto thee and to thy seed after thee the,Old Testament
"January 1, 1877 ",Doctrine and Covenants 133:26,0.7257,smite the rocks and the mountains of Ice shall flow down before them,stay themselves and they shall smite the rocks and the ice shall flow down at their presence,Doctrine and Covenants
"October 20, 1855 ",Matthew 10:6,0.7257,the lost sheep of the House of Israel He must also go and,But go rather to the lost sheep of the house of Israel,New Testament
"April 2, 1885 ",Jeremiah 17:20,0.72546,of man Again hear ye the word of the Lord O ye mine,And say unto them Hear ye the word of the Lord ye kings,Old Testament
"April 30, 1846 ",Hebrews 2:6,0.72471,is man that thou art mindful of him or the sun of man,But one in a certain place testified saying What is man that thou art mindful of him or the son of man that thou visitest him,New Testament
"February 26, 1879 ",2 Peter 1:21,0.72421,of humble men who spake as they were moved upon by the Holy,but holy men of God spake as they were moved by the Holy Ghost,New Testament
"January 1, 1877 ",Doctrine and Covenants 20:79,0.72369,God And we ask thee our Father in Heaven in the Name of,O God the Eternal Father we ask thee in the name of thy,Doctrine and Covenants
"January 1, 1877 ",Moroni 5:2,0.72369,God And we ask thee our Father in Heaven in the Name of,O God the Eternal Father we ask thee in the name of thy,Book of Mormon
"January 1, 1877 ",Doctrine and Covenants 20:77,0.72369,God And we ask thee our Father in Heaven in the Name of,O God the Eternal Father we ask thee in the name of thy,Doctrine and Covenants
"January 1, 1877 ",Moroni 4:3,0.72369,God And we ask thee our Father in Heaven in the Name of,O God the Eternal Father we ask thee in the name of thy,Book of Mormon
"January 20, 1872 ",Job 32:8,0.72366,to the saints The inspiration of the Almighty which giveth the spirit of,But there is a spirit in man and the inspiration of the Almighty giveth them understanding,Old Testament
"January 13, 1856 ",Doctrine and Covenants 27:9,0.72318,Fathers to the children and the hearts of the children to their Fathers,of turning the hearts of the fathers to the children and the hearts,Doctrine and Covenants
"June 2, 1836 ",Doctrine and Covenants 109:4,0.72285,her father O God I ask thee in the name of Christ to,And now we ask thee Holy Father in the name of Jesus Christ,Doctrine and Covenants
"January 21, 1847 ",Deuteronomy 12:12,0.72229,your flocks and in your herds and in your fields and in your,and your daughters and your menservants and your maidservants and the Levite that,Old Testament
"March 4, 1849 ",1 Corinthians 12:27,0.722,of the body of Christ And members in particular I told them I,Now ye are the body of Christ and members in particular,New Testament
"April 15, 1837 ",Deuteronomy 18:13,0.72177,Thou shalt labour in the Temple of the Lord thy God Thou shalt,Thou shalt be perfect with the Lord thy God,Old Testament
"April 7, 1844 ",Joel 2:29,0.72135,things and I will in the last days pour out my spirit upon,And also upon the servants and upon the handmaids in those days will I pour out my spirit,Old Testament
"September 12, 1857 ",Mosiah 27:32,0.72028,of a great many things which you have seen and heard The people,to all the people the things which they had heard and seen and,Book of Mormon
"June 11, 1843 ",Matthew 15:14,0.72027,blind may lead the blind and both fall into the deatch together Their,Let them alone they be blind leaders of the blind And if the blind lead the blind both shall fall into the ditch,New Testament
"January 13, 1881 ",Doctrine and Covenants 34:6,0.71974,right to Enjoy lift up your voice as with the sound of a,To lift up your voice as with the sound of a trump both,Doctrine and Covenants
"July 16, 1843 ",Philippians 3:14,0.71945,mark or the prize of the high calling in Christ Jesus we found,I press toward the mark for the prize of the high calling of God in Christ Jesus,New Testament
"April 19, 1893 ",Doctrine and Covenants 98:13,0.71861,sake for he that layeth down his life for my sake shall find,And whoso layeth down his life in my cause for my name's sake shall find it again even life eternal,Doctrine and Covenants
"January 4, 1852 ",Moses 7:11,0.71849,God the Father the Son and the Holy Ghost that bears record of,and truth and of the Holy Ghost which beareth record of the Father and the Son,Pearl of Great Price
"September 10, 1843 ",Jacob 6:8,0.71842,by the power of God and the gift of the Holy Ghost events,of Christ and the power of God and the gift of the Holy,Book of Mormon
"February 26, 1879 ",Jacob 6:9,0.7183,ye Latter Day Saints do ye not know these things are true You,Know ye not that if ye will do these things that the power,Book of Mormon
"January 13, 1856 ",Doctrine and Covenants 138:48,0.71802,work be done it will be done in Temples in our day and,Foreshadowing the great work to be done in the temples of the Lord,Doctrine and Covenants
"December 20, 1850 ",Revelation 7:4,0.71775,of the one hundred and forty four thousand sealed out of the Twelve,sealed an hundred and forty and four thousand of all the tribes of the children of Israel,New Testament
"April 6, 1864 ",Doctrine and Covenants 136:2,0.7176,Church of Jesus Christ of Latterday Saints President Brigham Young called the Meeting,Let all the people of The Church of Jesus Christ of Latterday Saints,Doctrine and Covenants
"October 22, 1840 ",Psalms 137:5,0.7173,of my mouth and my right hand forget her cunning when I will,If I forget thee O Jerusalem let my right hand forget her cunning,Old Testament
"February 26, 1879 ",Daniel 3:14,0.71724,serve thy Gods men worship the golden Image which thou hast set up,Abednego do not ye serve my gods nor worship the golden image which I have set up,Old Testament
"July 23, 1835 ",2 Corinthians 11:29,0.7172,same who is weak and I not weack who is offended and I,Who is weak and I am not weak who is offended and I burn not,New Testament
"August 8, 1844 ",2 Corinthians 5:7,0.71698,you called to walk by faith not by sight for always before you,For we walk by faith not by sight,New Testament
"January 21, 1847 ",Doctrine and Covenants 136:13,0.71614,Snow organize a company and let my servants Orson Pratt and Wilford Woodr[uff],And let my servants Orson Pratt and Wilford Woodruff organize a company,Doctrine and Covenants
"December 20, 1850 ",Ezekiel 39:4,0.71594,thee and reveal unto thee thy duty yea and give unto thee many,and the people that is with thee I will give thee unto the,Old Testament
"April 15, 1837 ",Deuteronomy 16:11,0.71593,Thou shalt labour in the Temple of the Lord thy God Thou shalt,And thou shalt rejoice before the Lord thy God thou and thy son,Old Testament
"February 7, 1885 ",Mark 6:13,0.71536,Oil and many were healed by the power of God Devils were cast,And they cast out many devils and anointed with oil many that were sick and healed them,New Testament
"January 21, 1844 ",Doctrine and Covenants 2:2,0.71523,hearts of the fathers to the children and the hearts of the children,to the fathers and the hearts of the children shall turn to their fathers,Doctrine and Covenants
"March 10, 1844 ",Doctrine and Covenants 2:2,0.71523,hearts of the Fathers to the Children and the hearts of the Children,to the fathers and the hearts of the children shall turn to their fathers,Doctrine and Covenants
"July 2, 1840 ",Articles of Faith 1:4,0.71496,repentance for remission of Sins and the gift of the Holy Ghost by,the remission of sins fourth Laying on of hands for the gift of the Holy Ghost,Pearl of Great Price
"March 7, 1897 ",Doctrine and Covenants 121:35,0.71496,of this world who aspire to the honors of men and do not,and aspire to the honors of men that they do not learn this one lesson,Doctrine and Covenants
"September 21, 1840 ",Acts 3:13,0.71471,of life and health and of Abraham of Isaac and of Jacob I,The God of Abraham and of Isaac and of Jacob the God of,New Testament
"January 1, 1877 ",Doctrine and Covenants 42:1,0.71454,ask in the name of Jesus Christ the son of the living God,my name even Jesus Christ the Son of the living God the Savior,Doctrine and Covenants
"April 6, 1871 ",Doctrine and Covenants 136:2,0.71406,Church of Jesus Christ of Latterday Saints in the New Tabernacle at 10,Let all the people of The Church of Jesus Christ of Latterday Saints,Doctrine and Covenants
"November 15, 1896 ",Doctrine and Covenants 53:1,0.71386,have raised up in these last days that I have ordained you to,in the church which I the Lord have raised up in these last days,Doctrine and Covenants
"August 16, 1844 ",Doctrine and Covenants 135:6,0.71382,the bible Book of Mormon or Doctrine and Covenants or any of the,the Book of Mormon and this book of Doctrine and Covenants of the,Doctrine and Covenants
"April 15, 1837 ",Job 5:24,0.71378,Thou shalt labour in the Temple of the Lord thy God Thou shalt,And thou shalt know that thy tabernacle shall be in peace and thou shalt visit thy habitation and shalt not sin,Old Testament
"July 29, 1843 ",Colossians 1:18,0.71377,in the Church and that he is at the head of the Church,And he is the head of the body the church who is the,New Testament
"August 5, 1860 ",Jacob 6:8,0.71357,spirit and power of God the Holy Ghost and the gift of eternal,of Christ and the power of God and the gift of the Holy,Book of Mormon
