date,verse_title,cosine_score,phrase_woodruff,phrase_scripture,volume_title
"July 13, 1859 ",Hebrews 11:1,0.8116,the substance of things hopede for and the evidence of things ^not seen^hoped,Now faith is the substance of things hoped for the evidence of things not seen,New Testament
"February 26, 1879 ",Doctrine and Covenants 133:33,0.8105,shall be filled with Songs of Everlasting Joy Behold this is the Blessing,And they shall be filled with songs of everlasting joy,Doctrine and Covenants
"January 22, 1843 ",Matthew 16:18,0.80856,this rock I will build my Church and the gates of hell shall,rock I will build my church and the gates of hell shall not prevail against it,New Testament
"August 15, 1858 ",3 Nephi 13:10,0.80847,will be done here on Earth as it is done in heaven then,Thy will be done on earth as it is in heaven,Book of Mormon
"January 3, 1838 ",John 15:13,0.80773,love hath any man than that he lay down his life for his,Greater love hath no man than this that a man lay down his life for his friends,New Testament
"February 26, 1879 ",Doctrine and Covenants 133:28,0.80757,the midst of the Great Deep Their Enemies shall become a prey unto,Their enemies shall become a prey unto them,Doctrine and Covenants
"April 6, 1873 ",Doctrine and Covenants 136:2,0.80695,Christ of Latterday Saints [] Church of Jesus Christ of Latterday Saints Met,Let all the people of The Church of Jesus Christ of Latterday Saints,Doctrine and Covenants
"April 9, 1852 ",Jude 1:6,0.80689,were reserved in everlasting chains of darkness unto the judgment of the great,habitation he hath reserved in everlasting chains under darkness unto the judgment of the great day,New Testament
"March 10, 1844 ",Doctrine and Covenants 98:16,0.80663,to seal the children to the fathers and fathers to the children now,of the children to their fathers and the hearts of the fathers to the children,Doctrine and Covenants
"September 9, 1843 ",Judges 10:6,0.80609,to take away the gods of the gods of the gentiles the Lord,gods of Zidon and the gods of Moab and the gods of the,Old Testament
"March 8, 1857 ",3 Nephi 14:14,0.8048,"""strait is the gate and narrow the way that leadeth unto Eternal life",Because strait is the gate and narrow is the way which leadeth unto life and few there be that find it,Book of Mormon
"March 8, 1857 ",Matthew 7:14,0.8048,"""strait is the gate and narrow the way that leadeth unto Eternal life",Because strait is the gate and narrow is the way which leadeth unto life and few there be that find it,New Testament
"February 25, 1858 ",Joseph Smith--History 1:65,0.80433,in money I took it out of my pocket and gave it to,it out of my pocket and gave it to him when he took,Pearl of Great Price
"November 2, 1858 ",Ecclesiastes 4:13,0.8038,that a wise child was Better than an old and foolish king I,Better is a poor and a wise child than an old and foolish king who will no more be admonished,Old Testament
"August 20, 1843 ",Revelation 16:6,0.80345,blood of Saints and Prophets and thou hast given them blood to drink,For they have shed the blood of saints and prophets and thou hast given them blood to drink for they are worthy,New Testament
"January 13, 1841 ",Moroni 10:4,0.80331,I ask God the Eternal Father in the name of Jesus Christ to,would ask God the Eternal Father in the name of Christ if these,Book of Mormon
"January 21, 1847 ",Doctrine and Covenants 136:28,0.80244,with music with dancing and with a prayer of praise and thanksgiving If,If thou art merry praise the Lord with singing with music with dancing and with a prayer of praise and thanksgiving,Doctrine and Covenants
"April 4, 1896 ",Doctrine and Covenants 105:15,0.80105,not many years hence they shall not be left to pollute my heritage,enemies and not many years hence they shall not be left to pollute,Doctrine and Covenants
"October 19, 1883 ",Exodus 19:6,0.80056,"""ye shall be unto me a kingdom of Priests"" W Woodruff spoke 20",And ye shall be unto me a kingdom of priests and an holy,Old Testament
"July 9, 1884 ",Doctrine and Covenants 112:14,0.80012,you And what I the Lord say unto you mine Apostles I say,Now I say unto you and what I say unto you I say,Doctrine and Covenants
"December 31, 1861 ",Doctrine and Covenants 135:6,0.79873,in the Book of Mormon and Doctrine and Covenants He has said that,the Book of Mormon and this book of Doctrine and Covenants of the,Doctrine and Covenants
"April 15, 1837 ",Deuteronomy 4:29,0.79685,Thou shalt labour in the Temple of the Lord thy God Thou shalt,But if from thence thou shalt seek the Lord thy God thou shalt,Old Testament
"March 11, 1859 ",Alma 50:22,0.7947,their Generation I said those who were faithful in keeping the commandments of,And those who were faithful in keeping the commandments of the Lord were,Book of Mormon
"January 21, 1847 ",Doctrine and Covenants 136:9,0.79362,those who are to remain behind this season and this is the will,are to remain behind this season and this is the will of the Lord concerning his people,Doctrine and Covenants
"January 21, 1847 ",Doctrine and Covenants 136:6,0.79342,When the companies are organized let them go to with their might to,When the companies are organized let them go to with their might to prepare for those who are to tarry,Doctrine and Covenants
"December 4, 1853 ",Matthew 7:1,0.79309,from this text Judge not that ye be not Judged He gave much,Judge not that ye be not judged,New Testament
"September 15, 1872 ",Revelation 10:10,0.7926,"my mouth sweet as Honey but in my belly it was bitter"" He",it up and it was in my mouth sweet as honey and as soon as I had eaten it my belly was bitter,New Testament
"November 11, 1855 ",Matthew 6:10,0.79249,"thy will be done on Earth as it is done in heaven[""] was",Thy kingdom come Thy will be done in earth as it is in heaven,New Testament
"January 13, 1856 ",3 Nephi 25:5,0.79244,will send you Elijah the prophet before the coming of the great and,Behold I will send you Elijah the prophet before the coming of the great and dreadful day of the Lord,Book of Mormon
"January 13, 1856 ",Malachi 4:5,0.79244,will send you Elijah the prophet before the coming of the great and,Behold I will send you Elijah the prophet before the coming of the great and dreadful day of the Lord,Old Testament
"April 7, 1848 ",Matthew 5:25,0.79228,ch of math Agree with thine Adversary quickly while thou art in the,Agree with thine adversary quickly whiles thou art in the way with him,New Testament
"February 26, 1879 ",Doctrine and Covenants 133:34,0.79132,of the Everlasting God upon the tribes of Israel And the richer blessing,Behold this is the blessing of the everlasting God upon the tribes of Israel and the richer blessing upon the head of Ephraim and his fellows,Doctrine and Covenants
"January 30, 1853 ",Numbers 32:33,0.79035,the kingdom of the Kingdom of God and the priesthood and Kingdom of,of Joseph the kingdom of Sihon king of the Amorites and the kingdom,Old Testament
"January 21, 1847 ",Doctrine and Covenants 136:25,0.79023,canst not repay then go straitway and tell thy neighbor lest he condemn,borrowed and if thou canst not repay then go straightway and tell thy neighbor lest he condemn thee,Doctrine and Covenants
"December 1, 1885 ",Doctrine and Covenants 103:30,0.78997,my servant John Taylor 1808 and my servant Wilford Woodruff and my servant,It is my will that my servant Parley P Pratt and my servant,Doctrine and Covenants
"January 1, 1877 ",Doctrine and Covenants 133:28,0.78898,at their Presence and their Enemies become a prey unto them May they,Their enemies shall become a prey unto them,Doctrine and Covenants
"April 7, 1844 ",Luke 15:7,0.7872,joy over one sinner that repenteth than over ninety and nine just persons,sinner that repenteth more than over ninety and nine just persons which need no repentance,New Testament
"September 7, 1851 ",Doctrine and Covenants 112:29,0.787,is as great a Prophet and he that believeth it may be saved and he that believeth it not will be damned,And he that believeth and is baptized shall be saved and he that believeth not and is not baptized shall be damned,Doctrine and Covenants
"March 14, 1885 ",Doctrine and Covenants 103:27,0.78614,life for my sake for He that layeth down his life for my,Let no man be afraid to lay down his life for my sake for whoso layeth down his life for my sake shall find it again,Doctrine and Covenants
"June 21, 1840 ",3 Nephi 9:2,0.78562,of God neither have ye sought to recover Israel WO WO WO unto,Wo wo wo unto this people wo unto the inhabitants of the whole,Book of Mormon
"October 12, 1856 ",Joseph Smith--History 1:71,0.7856,Woodruff laid hands upon his head and ordained him to the office of,baptized meafter which I laid my hands upon his head and ordained him,Pearl of Great Price
"January 21, 1847 ",Exodus 3:15,0.78495,the Lord your God even the God of your Fathers the God of,of Israel The Lord God of your fathers the God of Abraham the,Old Testament
"September 27, 1838 ",2 Corinthians 5:7,0.7849,day as we must walk by faith not by sight until he is,For we walk by faith not by sight,New Testament
"February 26, 1879 ",Daniel 6:5,0.78486,against this Daniel except we find it against him concerning the Law of,Then said these men We shall not find any occasion against this Daniel except we find it against him concerning the law of his God,Old Testament
"January 21, 1844 ",Malachi 4:6,0.78228,to their fathers lest I come and smite the whole earth with a,the heart of the children to their fathers lest I come and smite the earth with a curse,Old Testament
"January 21, 1844 ",3 Nephi 25:6,0.78228,to their fathers lest I come and smite the whole earth with a,the heart of the children to their fathers lest I come and smite the earth with a curse,Book of Mormon
"February 26, 1879 ",Doctrine and Covenants 1:38,0.78224,myself And though the Heavens and [Earth] pass away my words will not,myself and though the heavens and the earth pass away my word shall,Doctrine and Covenants
"February 26, 1879 ",Isaiah 66:16,0.78072,Lord plead with all flesh and the slain of the Lord will be,For by fire and by his sword will the Lord plead with all flesh and the slain of the Lord shall be many,Old Testament
"February 15, 1849 ",1 Nephi 14:14,0.78035,armed with righteousness in the power of God in great glory May all,upon all the face of the earth and they were armed with righteousness and with the power of God in great glory,Book of Mormon
"July 2, 1840 ",Doctrine and Covenants 138:33,0.78018,repentance for remission of Sins and the gift of the Holy Ghost by,remission of sins the gift of the Holy Ghost by the laying on of hands,Doctrine and Covenants
"January 21, 1847 ",Doctrine and Covenants 136:37,0.77964,marvel not at these things for ye are not yet pure thou canst,Therefore marvel not at these things for ye are not yet pure ye,Doctrine and Covenants
"December 1, 1885 ",Doctrine and Covenants 112:17,0.77697,my servant John Taylor 1808 and my servant Wilford Woodruff and my servant,in all places where my servant Joseph and my servant Sidney and my servant Hyrum cannot come,Doctrine and Covenants
"March 10, 1844 ",Mark 1:3,0.77614,the wilderness prepare ye the way of the Lord and make his paths,The voice of one crying in the wilderness Prepare ye the way of the Lord make his paths straight,New Testament
"March 10, 1844 ",Matthew 3:3,0.77614,the wilderness prepare ye the way of the Lord and make his paths,The voice of one crying in the wilderness Prepare ye the way of the Lord make his paths straight,New Testament
"January 21, 1847 ",Doctrine and Covenants 136:34,0.77567,the ungodly Thy brethren have rejected you and your testimony even the Nation,Thy brethren have rejected you and your testimony even the nation that has driven you out,Doctrine and Covenants
"November 18, 1855 ",Doctrine and Covenants 84:69,0.77559,eyes of the blind unstop the ears of the deaf cause the lame,In my name they shall open the eyes of the blind and unstop the ears of the deaf,Doctrine and Covenants
"September 8, 1851 ",Numbers 15:3,0.7753,the Lord Bring an offering to the Lord I will make an Offering,And will make an offering by fire unto the Lord a burnt offering,Old Testament
"September 9, 1843 ",Doctrine and Covenants 43:24,0.77383,gathereth her chickens under her wings but they would not God and Angels,together as a hen gathereth her chickens under her wings but ye would not!,Doctrine and Covenants
"March 29, 1838 ",Luke 11:29,0.77382,that there should no sign be given but the sign of the Prophet,is an evil generation they seek a sign and there shall no sign be given it but the sign of Jonas the prophet,New Testament
"February 12, 1862 ",Doctrine and Covenants 107:54,0.77343,and blessed Adam OT and called him the Prince Michael the Archangel and,And the Lord appeared unto them and they rose up and blessed Adam and called him Michael the prince the archangel,Doctrine and Covenants
"January 21, 1847 ",1 Kings 6:1,0.77314,children of Israel out of the Land of Egypt and my arm is,the children of Israel were come out of the land of Egypt in,Old Testament
"October 26, 1840 ",Job 1:21,0.77292,gave and the Lord hath taken away and blessed be the name of,I return thither the Lord gave and the Lord hath taken away blessed be the name of the Lord,Old Testament
"January 21, 1847 ",Doctrine and Covenants 136:17,0.7728,I have told you and fear not thine enemies for they shall not,Go thy way and do as I have told you and fear not thine enemies for they shall not have power to stop my work,Doctrine and Covenants
"June 1, 1843 ",Philippians 4:23,0.77175,the grace of Jesus Christ our Lord be and abide with you all,The grace of our Lord Jesus Christ be with you all Amen,New Testament
"June 1, 1843 ",Revelation 22:21,0.77175,the grace of Jesus Christ our Lord be and abide with you all,The grace of our Lord Jesus Christ be with you all Amen,New Testament
"June 1, 1843 ",Romans 16:24,0.77175,the grace of Jesus Christ our Lord be and abide with you all,The grace of our Lord Jesus Christ be with you all Amen,New Testament
"June 1, 1843 ",2 Thessalonians 3:18,0.77175,the grace of Jesus Christ our Lord be and abide with you all,The grace of our Lord Jesus Christ be with you all Amen,New Testament
"December 31, 1840 ",Psalms 84:10,0.77116,of God than to dwell in the tents of wickedness I felt much,rather be a doorkeeper in the house of my God than to dwell in the tents of wickedness,Old Testament
"January 21, 1847 ",Doctrine and Covenants 136:7,0.77083,Farming utensils to go as Pioneers to prepare for puting in spring crops,to take teams seeds and farming utensils to go as pioneers to prepare for putting in spring crops,Doctrine and Covenants
"December 31, 1836 ",Doctrine and Covenants 1:38,0.77011,to show that though the heavens and earth pass away the word of,myself and though the heavens and the earth pass away my word shall,Doctrine and Covenants
"March 14, 1885 ",Doctrine and Covenants 43:26,0.76969,in iniquity and the cup of the wrath of mine indignation is full,Behold the day has come when the cup of the wrath of mine indignation is full,Doctrine and Covenants
"January 21, 1847 ",Doctrine and Covenants 136:36,0.76937,they have shed innocent blood which crieth from the ground against them Therefore,For they killed the prophets and them that were sent unto them and they have shed innocent blood which crieth from the ground against them,Doctrine and Covenants
"March 18, 1860 ",Doctrine and Covenants 76:34,0.76915,which their is no forgiveness in this world nor in the world to,Concerning whom I have said there is no forgiveness in this world nor in the world to come,Doctrine and Covenants
"August 8, 1847 ",Mormon 7:2,0.76846,on the earth and ye are the people ye Elders of Israel and,Know ye that ye are of the house of Israel,Book of Mormon
"January 13, 1856 ",Doctrine and Covenants 128:17,0.76799,"lest I come and smite the Earth with a curse"" Abram received the",of the children to their fathers lest I come and smite the earth with a curse,Doctrine and Covenants
"December 20, 1850 ",Deuteronomy 33:17,0.76753,one of the Horns of Joseph to push the people together to the,like the horns of unicorns with them he shall push the people together,Old Testament
"July 28, 1860 ",Doctrine and Covenants 93:3,0.76751,Now Jesus said I am in the Father and the Father in me,And that I am in the Father and the Father in me and the Father and I are one,Doctrine and Covenants
"March 7, 1844 ",2 Nephi 27:32,0.76731,and will make a man an offender for a word But I will,And they that make a man an offender for a word and lay,Book of Mormon
"March 3, 1840 ",Doctrine and Covenants 98:16,0.76503,fathers to the children and the children to the Fathers which fulfills the,of the children to their fathers and the hearts of the fathers to the children,Doctrine and Covenants
"August 20, 1843 ",Revelation 16:3,0.76486,it became as the blood of a dead man and evry living soul,became as the blood of a dead man and every living soul died in the sea,New Testament
"April 4, 1896 ",Haggai 2:9,0.76465,Saith the Lord of hosts I the Lord have spoken and will be,saith the Lord of hosts and in this place will I give peace saith the Lord of hosts,Old Testament
"January 21, 1847 ",Doctrine and Covenants 136:1,0.76465,The word and will of the Lord concerning the camp of Israel In,The Word and Will of the Lord concerning the Camp of Israel in their journeyings to the West,Doctrine and Covenants
"April 15, 1837 ",John 21:18,0.7646,Thou shalt labour in the Temple of the Lord thy God Thou shalt,and walkedst whither thou wouldest but when thou shalt be old thou shalt,New Testament
"September 10, 1843 ",Ephesians 4:12,0.76459,the work of the ministry and the edifying of the body of Christ,For the perfecting of the saints for the work of the ministry for the edifying of the body of Christ,New Testament
"April 27, 1847 ",Joshua 15:61,0.7645,the wilderness we ar now in a tabernacle in the wilderness and getting,In the wilderness Betharabah Middin and Secacah,Old Testament
"January 21, 1847 ",Doctrine and Covenants 136:37,0.76321,not yet bear my glory but thou shalt behold it if ye are,can not yet bear my glory but ye shall behold it if ye,Doctrine and Covenants
"December 19, 1885 ",1 Kings 8:39,0.76241,no man as thou knowest for thou knowest all our ways Thou hast,give to every man according to his ways whose heart thou knowest for thou even thou only knowest the hearts of all the children of men,Old Testament
"December 1, 1885 ",Doctrine and Covenants 75:31,0.76237,my servant John Taylor 1808 and my servant Wilford Woodruff and my servant,And also my servant Ezra Thayre and my servant Thomas B Marsh,Doctrine and Covenants
"April 15, 1837 ",John 21:18,0.76073,thee Thou shalt have long life and see good days Thou shalt be,and walkedst whither thou wouldest but when thou shalt be old thou shalt,New Testament
"January 13, 1856 ",Doctrine and Covenants 2:2,0.76072,will turn the hearts of the children to the Ancient Fathers and the,to the fathers and the hearts of the children shall turn to their fathers,Doctrine and Covenants
"June 23, 1870 ",Doctrine and Covenants 135:6,0.76052,the Bible Doctrine and Covenants and in the Book of Mormon the Blessings,the Book of Mormon and this book of Doctrine and Covenants of the,Doctrine and Covenants
"December 16, 1857 ",Exodus 13:21,0.75875,pillar of fire by night and a cloud by day And the way,cloud to lead them the way and by night in a pillar of fire to give them light to go by day and night,Old Testament
"October 20, 1855 ",2 Nephi 31:21,0.75846,other name given under Heaven whereby men can be saved we have no,none other way nor name given under heaven whereby man can be saved,Book of Mormon
"September 5, 1841 ",Joseph Smith--History 1:3,0.75804,in the year of our Lord one thousand eight hundred and thirty six,I was born in the year of our Lord one thousand eight hundred,Pearl of Great Price
"January 21, 1847 ",Doctrine and Covenants 136:41,0.75783,Now therefore harken O ye people of my church and ye Elders listen,Now therefore hearken O ye people of my church and ye elders listen together you have received my kingdom,Doctrine and Covenants
"December 16, 1857 ",Exodus 13:22,0.75771,pillar of fire by night and a cloud by day And the way,He took not away the pillar of the cloud by day nor the pillar of fire by night from before the people,Old Testament
"September 8, 1851 ",2 Nephi 9:28,0.75733,of God and they think they are in it when they have not,frailties and the foolishness of men! When they are learned they think they,Book of Mormon
"January 9, 1894 ",Joseph Smith--Matthew 1:35,0.75701,all be fulfilled And though heaven and earth pass away my words shall,Although the days will come that heaven and earth shall pass away yet my words shall not pass away but all shall be fulfilled,Pearl of Great Price
"July 24, 1887 ",Doctrine and Covenants 84:92,0.75636,cold and cleanse your feet in water pure water it matters not whether,cleanse your feet even with water pure water whether in heat or in,Doctrine and Covenants
"October 9, 1851 ",1 John 5:3,0.75626,for we have to keep all the commandments of God if commandments are,For this is the love of God that we keep his commandments and his commandments are not grievous,New Testament
"April 15, 1837 ",Doctrine and Covenants 42:54,0.75613,Thou shalt labour in the Temple of the Lord thy God Thou shalt,Thou shalt not take thy brother's garment thou shalt pay for that which thou shalt receive of thy brother,Doctrine and Covenants
"February 3, 1854 ",1 Thessalonians 4:17,0.75594,meet the Lord in the air when he shall come in the clouds,them in the clouds to meet the Lord in the air and so shall we ever be with the Lord,New Testament
"January 21, 1847 ",Doctrine and Covenants 136:37,0.7557,by mine own voice out of the Heavens to bring forth my work,whom I did call upon by mine angels my ministering servants and by mine own voice out of the heavens to bring forth my work,Doctrine and Covenants
"December 31, 1849 ",Doctrine and Covenants 101:89,0.75554,place and in his fury He will vex the Nation And in his,come forth out of his hiding place and in his fury vex the nation,Doctrine and Covenants
"March 10, 1844 ",Acts 3:19,0.75418,your sins may be blotted out when the times of refreshing shall come,Repent ye therefore and be converted that your sins may be blotted out when the times of refreshing shall come from the presence of the Lord,New Testament
"December 19, 1885 ",Doctrine and Covenants 109:61,0.7541,no man as thou knowest for thou knowest all our ways Thou hast,But thou knowest that thou hast a great love for the children of,Doctrine and Covenants
"April 30, 1897 ",Doctrine and Covenants 121:36,0.75356,Els For the Rights of the Priesthood are inseparably connected with the Heavens,That the rights of the priesthood are inseparably connected with the powers of,Doctrine and Covenants
"December 1, 1885 ",Doctrine and Covenants 124:62,0.75295,my servant John Taylor 1808 and my servant Wilford Woodruff and my servant,servant Lyman Wight and my servant John Snider and my servant Peter Haws,Doctrine and Covenants
"April 11, 1893 ",Doctrine and Covenants 118:6,0.75268,the Lord unto my servant John Taylor 1808 and my servant Wilford Woodruff,Let my servant John Taylor and also my servant John E Page and,Doctrine and Covenants
"December 31, 1873 ",Doctrine and Covenants 136:2,0.75212,I was Baptized into the Church of Jesus Christ of Latterday Saints I,Let all the people of The Church of Jesus Christ of Latterday Saints,Doctrine and Covenants
"July 9, 1884 ",Doctrine and Covenants 105:14,0.75174,fight your battles as I have said in a former Commandment it is,of Zion for as I said in a former commandment even so will I fulfilI will fight your battles,Doctrine and Covenants
"February 2, 1851 ",Luke 1:17,0.75108,turn the hearts of the children to their fathers and the fathers to,to turn the hearts of the fathers to the children and the disobedient,New Testament
"March 10, 1844 ",Hebrews 6:5,0.75002,and tasted of the powers of the world to come if they shall,And have tasted the good word of God and the powers of the world to come,New Testament
"September 21, 1847 ",Nehemiah 8:4,0.74958,and placed them on his left hand and ourselves on his right and,and Urijah and Hilkiah and Maaseiah on his right hand and on his,Old Testament
"December 1, 1885 ",Doctrine and Covenants 118:6,0.74947,my servant John Taylor 1808 and my servant Wilford Woodruff and my servant,also my servant Wilford Woodruff and also my servant Willard Richards be appointed,Doctrine and Covenants
"January 22, 1843 ",Doctrine and Covenants 27:7,0.74868,have a son whose name should be John and he should be filled,gave promise that he should have a son and his name should be John and he should be filled with the spirit of Elias,Doctrine and Covenants
"April 15, 1837 ",Deuteronomy 10:20,0.74852,Thou shalt labour in the Temple of the Lord thy God Thou shalt,Thou shalt fear the Lord thy God him shalt thou serve and to him shalt thou cleave and swear by his name,Old Testament
"September 10, 1843 ",2 Peter 1:21,0.7485,God spake as they were moved upon by the Holy Ghost Isaiah soul,but holy men of God spake as they were moved by the Holy Ghost,New Testament
"March 27, 1842 ",Doctrine and Covenants 128:16,0.7478,"baptized for the dead if the dead rise not and"" if their is",which are baptized for the dead if the dead rise not at all Why are they then baptized for the dead,Doctrine and Covenants
"February 12, 1853 ",Ecclesiastes 7:2,0.7478,for that is the end of all men and the living will lay,to the house of feasting for that is the end of all men and the living will lay it to his heart,Old Testament
"January 21, 1847 ",Exodus 3:16,0.7477,the Lord your God even the God of your Fathers the God of,Lord God of your fathers the God of Abraham of Isaac and of,Old Testament
