index_woodruff,index_scriptures,date,cosine_score,verse_title,volume_title,phrase_woodruff,phrase_scripture
111696,4758,"March 7, 1897 ",0.72445,Doctrine and Covenants 121:36,Doctrine and Covenants,rights of the priesthood are in separably connected with the powers of heaven and that the powers of heaven cannot be con trolled nor handled only upon the principles of,That the rights of the priesthood are inseparably connected with the powers of heaven and that the powers of heaven cannot be controlled nor handled only upon the principles of righteousness
115057,4758,"April 30, 1897 ",0.72265,Doctrine and Covenants 121:36,Doctrine and Covenants,Els For the Rights of the Priesthood are inseparably connected with the Heavens and the,That the rights of the priesthood are inseparably connected with the powers of heaven and
58492,3167,"January 23, 1848 ",0.71808,Doctrine and Covenants 88:41,Doctrine and Covenants,through all things and round about all things and that governed and controlled all things,He comprehendeth all things and all things are before him and all things are round
27456,2966,"November 18, 1855 ",0.71806,Doctrine and Covenants 84:69,Doctrine and Covenants,and cast out devils open the eyes of the blind unstop the ears of the,In my name they shall open the eyes of the blind and unstop the ears of the deaf
81574,4291,"February 12, 1862 ",0.71416,Doctrine and Covenants 107:53,Doctrine and Covenants,were High Priests with the residue of his posterity who were righteous into the valley,Enoch and Methuselah who were all high priests with the residue of his posterity who were righteous into the valley of AdamondiAhman and there bestowed upon them his last blessing
18942,1436,"June 11, 1843 ",0.71373,Doctrine and Covenants 43:24,Doctrine and Covenants,gatherd you togetherd as a hen gathereth her chickens under wings But ye would not,O ye nations of the earth how often would I have gathered you together as a hen gathereth her chickens under her wings but ye would not!
82835,5800,"April 6, 1873 ",0.71126,Doctrine and Covenants 136:2,Doctrine and Covenants,Latterday Saints [] Church of Jesus Christ of Latterday Saints Met in the Tabernacle Salt,Let all the people of The Church of Jesus Christ of Latterday Saints and those
62731,709,"August 13, 1857 ",0.7108,Doctrine and Covenants 20:77,Doctrine and Covenants,dedication prayer [] O God our Eternal Father we ask thee in the name of,O God the Eternal Father we ask thee in the name of thy Son Jesus
62731,716,"August 13, 1857 ",0.7108,Doctrine and Covenants 20:79,Doctrine and Covenants,dedication prayer [] O God our Eternal Father we ask thee in the name of,O God the Eternal Father we ask thee in the name of thy Son Jesus
90242,1872,"February 26, 1879 ",0.70964,Doctrine and Covenants 56:11,Doctrine and Covenants,myself And though the Heavens and [Earth] pass away my words will not pass away,And though the heaven and the earth pass away these words shall not pass away but shall be fulfilled
111853,899,"October 23, 1893 ",0.70891,Doctrine and Covenants 29:5,Doctrine and Covenants,Presidency of the Church your hearts be troubled I am in your midst I am,Lift up your hearts and be glad for I am in your midst and am
51841,5802,"April 16, 1847 ",0.70847,Doctrine and Covenants 136:3,Doctrine and Covenants,4 Captains of fifties and Captains of tens I was appointed Capt of ten the,Let the companies be organized with captains of hundreds captains of fifties and captains of
13465,2367,"June 30, 1843 ",0.70843,Doctrine and Covenants 68:9,Doctrine and Covenants,power in the Charters of Nauvoo shall be saved he that believeth not shall not,And he that believeth and is baptized shall be saved and he that believeth not shall be damned
2657,4355,"August 18, 1844 ",0.70673,Doctrine and Covenants 107:93,Doctrine and Covenants,of seven men will be chosen out of the first seventy to preside over each,should have seven presidents to preside over them chosen out of the number of the seventy
22820,4541,"November 16, 1838 ",0.70579,Doctrine and Covenants 111:7,Doctrine and Covenants,tarry in Kirtland or in the regions round about until spring we have had many,Tarry in this place and in the regions round about
81577,4292,"February 12, 1862 ",0.70574,Doctrine and Covenants 107:54,Doctrine and Covenants,him the Prince Michael the Archangel and the Lord administered comfort unto Adam and said,And the Lord appeared unto them and they rose up and blessed Adam and called him Michael the prince the archangel
3209,894,"September 9, 1843 ",0.70361,Doctrine and Covenants 29:2,Doctrine and Covenants,said he would gather the Jews oft as a hen gathereth her chickens under her,Who will gather his people even as a hen gathereth her chickens under her wings
35782,5951,"December 31, 1872 ",0.70357,Doctrine and Covenants 138:53,Doctrine and Covenants,Joseph Smith Jr the Prophet 5 to Hyrum Smith Patriarch 4 To Father John Smith,The Prophet Joseph Smith and my father Hyrum Smith Brigham Young John Taylor Wilford Woodruff
98902,4263,"April 2, 1885 ",0.70283,Doctrine and Covenants 107:35,Doctrine and Covenants,the Gospel of Jesus Christ to the Gentiles first and then to the House of,of the gospel of Jesus Christ and first unto the Gentiles and then unto the Jews
1743,2568,"April 15, 1837 ",0.70171,Doctrine and Covenants 76:7,Doctrine and Covenants,mysteries in this generation Yea all the mysteries of the kingdom of God and the,And to them will I reveal all mysteries yea all the hidden mysteries of my
99635,2712,"October 6, 1884 ",0.70139,Doctrine and Covenants 76:119,Doctrine and Covenants,honor power and Glory unto God and the Lamb both Now and forever Amen March,And to God and the Lamb be glory and honor and dominion forever and ever Amen
48183,1977,"December 20, 1850 ",0.70062,Doctrine and Covenants 58:45,Doctrine and Covenants,the Horns of Joseph to push the people together to the Ends of the Earth,For behold they shall push the people together from the ends of the earth
12005,5102,"August 12, 1844 ",0.70021,Doctrine and Covenants 124:129,Doctrine and Covenants,Young Heber Chase Kimball Parley Parker Pratt Orson Pratt Willard Richards W Woodruff John Taylor,They are Heber C Kimball Parley P Pratt Orson Pratt Orson Hyde William Smith John Taylor John E Page Wilford Woodruff Willard Richards George A Smith
