verse_title,cosine_score,phrase_woodruff,phrase_scripture,volume_title
Malachi 4:6,0.777442824449628,"""and he shall turn the hearts of the fathers to",and he shall turn the heart of the fathers to,Old Testament
Doctrine and Covenants 133:4,0.7774178724419286,ye people of my church and ye elders listen together,gather ye together o ye people of my church upon,Doctrine and Covenants
Doctrine and Covenants 136:13,0.7771978156432676,erastus snow organize a company and let my servants orson,and let my servants orson pratt and wilford woodruff organize a company,Doctrine and Covenants
Alma 9:12,0.777107475942082,to destroy us from off the face of the earth,destroy you from off the face of the earth yea,Book of Mormon
Matthew 6:10,0.77710115942529,come and thy will be done on earth as it,thy kingdom come thy will be done in earth as it is in heaven,New Testament
Doctrine and Covenants 33:15,0.7770557333497945,to him by prayer and the laying on of hands,by the laying on of the hands and i will,Doctrine and Covenants
3 Nephi 7:23,0.7769584151395121,baptism of repentance unto the remission of sins for the,them repentance and remission of sins,Book of Mormon
Moses 7:65,0.7766934970132424,be prepared for the coming of the son of man,of the coming of the son of man in the,Pearl of Great Price
Doctrine and Covenants 128:18,0.7766901486742652,our dead paul cannot be made perfect without us for,the dead for we without them cannot be made perfect,Doctrine and Covenants
Jeremiah 42:1,0.7766564697233181,the son and the son in the father in the,son of kareah and jezaniah the son of hoshaiah and,Old Testament
2 Kings 22:12,0.7766564697233181,the son and the son in the father in the,son of shaphan and achbor the son of michaiah and,Old Testament
Ezekiel 44:5,0.7765106906016387,administer in the ordinances of the house of the lord,ordinances of the house of the lord and all the,Old Testament
Matthew 24:37,0.7764553443643354,shall it be in the coming of the son of,the coming of the son of man be,New Testament
Moroni 10:5,0.7763947815272843,upon by the power of the holy ghost and the,and by the power of the holy ghost ye may,Book of Mormon
Doctrine and Covenants 133:32,0.7763535427117232,in zion by the hands of the servants of the,glory even in zion by the hands of the servants,Doctrine and Covenants
Isaiah 22:25,0.7762788644800883,saith the lord of hosts as i the lord have,in that day saith the lord of hosts shall the,Old Testament
Philippians 2:11,0.7762560924105321,tongue confess that jesus was the christ and this will,and that every tongue should confess that jesus christ is,New Testament
Moses 7:65,0.7760676959369003,the son of man for his coming is at the,of the coming of the son of man in the,Pearl of Great Price
Doctrine and Covenants 53:3,0.7759916491648796,persons by the laying on of hands in the name,by the laying on of hands,Doctrine and Covenants
Doctrine and Covenants 128:21,0.7759307485368634,of the church of jesus christ of latterday saints he,tribulations of this church of jesus christ of latterday saints!,Doctrine and Covenants
1 Kings 16:13,0.7758130321482924,and acknowledge all his sins and the sins of his,for all the sins of baasha and the sins of,Old Testament
Doctrine and Covenants 136:34,0.7757182910480296,your testimony even the nation that has driven you out,nation that has driven you out,Doctrine and Covenants
Doctrine and Covenants 84:28,0.7756982145150861,upon them to prepare the kingdom for the coming of,his people to prepare them for the coming of the,Doctrine and Covenants
Deuteronomy 28:25,0.7756152021604418,of all other kingdoms upon earth and we are the,all the kingdoms of the earth,Old Testament
Doctrine and Covenants 28:6,0.7755295623882521,and that he is at the head of the church,head and at the head of the church,Doctrine and Covenants
Ezra 2:44,0.7751631471095689,with the children all the children over 8 years of,the children of keros the children of siaha the children of padon,Old Testament
Ezra 2:48,0.7751631471095689,with the children all the children over 8 years of,the children of rezin the children of nekoda the children of gazzam,Old Testament
Ezra 2:46,0.7751631471095689,with the children all the children over 8 years of,the children of hagab the children of shalmai the children of hanan,Old Testament
Ezra 2:53,0.7751631471095689,with the children all the children over 8 years of,the children of barkos the children of sisera the children of thamah,Old Testament
Nehemiah 7:56,0.7751631471095689,with the children all the children over 8 years of,the children of neziah the children of hatipha,Old Testament
Nehemiah 7:55,0.7751631471095689,with the children all the children over 8 years of,the children of barkos the children of sisera the children of tamah,Old Testament
Ezra 2:45,0.7751631471095689,with the children all the children over 8 years of,the children of lebanah the children of hagabah the children of akkub,Old Testament
Nehemiah 7:54,0.7751631471095689,with the children all the children over 8 years of,the children of bazlith the children of mehida the children of harsha,Old Testament
Nehemiah 7:50,0.7751631471095689,with the children all the children over 8 years of,the children of reaiah the children of rezin the children of nekoda,Old Testament
Nehemiah 7:49,0.7751631471095689,with the children all the children over 8 years of,the children of hanan the children of giddel the children of gahar,Old Testament
Ezra 2:56,0.7751631471095689,with the children all the children over 8 years of,the children of jaalah the children of darkon the children of giddel,Old Testament
Nehemiah 7:58,0.7751631471095689,with the children all the children over 8 years of,the children of jaala the children of darkon the children of giddel,Old Testament
Nehemiah 7:47,0.7751631471095689,with the children all the children over 8 years of,the children of keros the children of sia the children of padon,Old Testament
Nehemiah 7:53,0.7751631471095689,with the children all the children over 8 years of,the children of bakbuk the children of hakupha the children of harhur,Old Testament
Nehemiah 7:52,0.7751631471095689,with the children all the children over 8 years of,the children of besai the children of meunim the children of nephishesim,Old Testament
Nehemiah 7:48,0.7751631471095689,with the children all the children over 8 years of,the children of lebana the children of hagaba the children of shalmai,Old Testament
Ezra 2:50,0.7751631471095689,with the children all the children over 8 years of,the children of asnah the children of mehunim the children of nephusim,Old Testament
Ezra 2:51,0.7751631471095689,with the children all the children over 8 years of,the children of bakbuk the children of hakupha the children of harhur,Old Testament
Ezra 2:54,0.7751631471095689,with the children all the children over 8 years of,the children of neziah the children of hatipha,Old Testament
Ezra 2:49,0.7751631471095689,with the children all the children over 8 years of,the children of uzza the children of paseah the children of besai,Old Testament
Ezra 2:47,0.7751631471095689,with the children all the children over 8 years of,the children of giddel the children of gahar the children of reaiah,Old Testament
Nehemiah 7:51,0.7751631471095689,with the children all the children over 8 years of,the children of gazzam the children of uzza the children of phaseah,Old Testament
Ezra 2:52,0.7751631471095689,with the children all the children over 8 years of,the children of bazluth the children of mehida the children of harsha,Old Testament
Doctrine and Covenants 135:6,0.7751599437871031,bible book of mormon and doctrine and covenants all good,book of mormon and this book of doctrine and covenants,Doctrine and Covenants
Doctrine and Covenants 98:16,0.7750349714557424,of the fathers to the children and the children to,the hearts of the fathers to the children,Doctrine and Covenants
Revelation 14:13,0.7749123168377023,"""blessed are the dead who die in the lord for",write blessed are the dead which die in the lord,New Testament
Ezekiel 12:15,0.7748448067259586,shall know that i am god as i the lord,and they shall know that i am the lord when,Old Testament
Ezekiel 30:8,0.7748448067259586,shall know that i am god as i the lord,and they shall know that i am the lord when,Old Testament
Isaiah 8:19,0.7748361975592488,ordained 7 elders for the dead 1 for the living,for the living to the dead,Old Testament
3 Nephi 18:10,0.7747940716527916,ye strive o! ye gentiles for this thing ye are,them blessed are ye for this thing which ye have,Book of Mormon
Exodus 4:13,0.7747940324006779,and send by whom thou wilt but send that thy,by the hand of him whom thou wilt send,Old Testament
Doctrine and Covenants 63:53,0.774758502991084,and earth of the coming of the son of man,even in the day of the coming of the son of man,Doctrine and Covenants
Numbers 2:12,0.7746221881423174,shall it be in the coming of the son of,shall be shelumiel the son of zurishaddai,Old Testament
Numbers 2:27,0.7746221881423174,shall it be in the coming of the son of,shall be pagiel the son of ocran,Old Testament
Nehemiah 7:57,0.7745745952860408,of the fathers to the children and the children to,children of sophereth the children of perida,Old Testament
Ezra 2:55,0.7745745952860408,of the fathers to the children and the children to,children of sophereth the children of peruda,Old Testament
Numbers 29:1,0.7745521759388783,1st 1838 on this seventh month the first day of,and in the seventh month on the first day of,Old Testament
Exodus 17:10,0.7744651994230816,to the top of the hill before meeting and took,to the top of the hill,Old Testament
2 Nephi 5:10,0.7741938560100703,the commandments and statutes of the lord our god let,statutes and the commandments of the lord in all things,Book of Mormon
Psalms 89:52,0.7741664718703715,to god and the lamb amen amen and amen this,blessed be the lord for evermore amen and amen,Old Testament
Luke 11:29,0.7741015321578714,upon that there should no sign be given but the,sign and there shall no sign be given it but,New Testament
2 Kings 9:2,0.7738452170140935,the son and the son in the father in the,son of jehoshaphat the son of nimshi and go in,Old Testament
Nehemiah 7:46,0.7738332948660764,with the children all the children over 8 years of,the nethinims the children of ziha the children of hashupha the children of tabbaoth,Old Testament
Ezra 2:43,0.7738332948660764,with the children all the children over 8 years of,the nethinims the children of ziha the children of hasupha the children of tabbaoth,Old Testament
Acts 4:25,0.7737757668369372,"""the heathen rage and the people imagin vain things they",why did the heathen rage and the people imagine vain things,New Testament
Doctrine and Covenants 84:114,0.773710475173421,and warning them of the desolation and utter abolishment which,voice of the desolation and utter abolishment which await them,Doctrine and Covenants
Joseph Smith--Matthew 1:48,0.7735965783008782,also ready for in such an hour as ye think,therefore be ye also ready for in such an hour,Pearl of Great Price
Matthew 24:44,0.7735965783008782,also ready for in such an hour as ye think,therefore be ye also ready for in such an hour,New Testament
Doctrine and Covenants 59:15,0.7735725898443356,meet brother joseph with a glad heart and cheerful countenance,is sin but with a glad heart and a cheerful countenance,Doctrine and Covenants
Alma 2:4,0.7731085448857326,and deprive us of our rights and privileges as they,deprive them of their rights and privileges of the church,Book of Mormon
Doctrine and Covenants 18:32,0.7730776294794401,upon by the power of the holy ghost and the,to the power of the holy ghost which is in,Doctrine and Covenants
Ether 4:10,0.7730500838872351,that believeth it may be saved and he that believeth,and he that believeth not my words believeth not my,Book of Mormon
Matthew 7:1,0.7730315234097244,not that ye be not judged he gave much good,judge not that ye be not judged,New Testament
Nehemiah 7:57,0.7728855539592613,to the children and the hearts of the children to,children of sophereth the children of perida,Old Testament
Nehemiah 7:57,0.7728855539592613,to the children and the hearts of the children to,children of sophereth the children of perida,Old Testament
Ezra 2:55,0.7728855539592613,to the children and the hearts of the children to,children of sophereth the children of peruda,Old Testament
Ezra 2:55,0.7728855539592613,to the children and the hearts of the children to,children of sophereth the children of peruda,Old Testament
Doctrine and Covenants 101:39,0.7728815479786211,of men and the crops of the earth and the,of the earth and the savor of men,Doctrine and Covenants
Doctrine and Covenants 76:52,0.7728589246212335,we administered to him by the laying on of hands,by the laying on of the hands of him who,Doctrine and Covenants
Doctrine and Covenants 76:52,0.7728589246212335,we administered to him by the laying on of hands,by the laying on of the hands of him who,Doctrine and Covenants
1 Nephi 3:21,0.7727590284614625,said those who were faithful in keeping the commandments of,faithful in keeping the commandments of god,Book of Mormon
Doctrine and Covenants 45:39,0.7727527827892932,people israel until the coming of the son of man,coming of the son of man,Doctrine and Covenants
Doctrine and Covenants 1:13,0.7726844961925078,the world for his anger is kindled and the slain,and the anger of the lord is kindled and his,Doctrine and Covenants
1 Kings 11:32,0.7726230944075946,my sake and for the sake of christ and the,sake and for jerusalem's sake the city which i have,Old Testament
3 Nephi 14:14,0.7724743563489572,"""strait is the gate and narrow the way that leadeth",because strait is the gate and narrow is the way,Book of Mormon
Matthew 7:14,0.7724743563489572,"""strait is the gate and narrow the way that leadeth",because strait is the gate and narrow is the way,New Testament
Nehemiah 7:11,0.7723153603797086,of the fathers to the children and the children to,the children of pahathmoab of the children of jeshua and,Old Testament
Judges 4:6,0.7723153603797086,of the fathers to the children and the children to,the children of naphtali and of the children of zebulun,Old Testament
Ezra 2:6,0.7723153603797086,of the fathers to the children and the children to,the children of pahathmoab of the children of jeshua and,Old Testament
Doctrine and Covenants 127:12,0.7721555372266128,of the church of jesus christ of latterday saints he,lord prophet and seer of the church of jesus christ of latterday saints,Doctrine and Covenants
Ezekiel 44:5,0.7721291639089858,the ordinances of the house of the lord is baptism,ordinances of the house of the lord and all the,Old Testament
Doctrine and Covenants 68:8,0.7720534675390044,to go to all the world and preach this gospel,go ye into all the world preach the gospel to,Doctrine and Covenants
Judges 19:30,0.7720273409326116,"so that it was said of him ""that it would",and it was so that all that saw it said,Old Testament
Amos 5:16,0.7718235546889988,saith the lord of hosts i the lord have spoken,therefore the lord the god of hosts the lord saith,Old Testament
Doctrine and Covenants 107:55,0.7717987061984145,"thou art a prince over them forever"" ""and adam stood",art a prince over them forever,Doctrine and Covenants
Doctrine and Covenants 76:114,0.7716967447112599,"old ""great and marvelous are thy works ""o lord god",but great and marvelous are the works of the lord,Doctrine and Covenants
Nehemiah 12:35,0.771602681144527,the son and the son in the father in the,of mattaniah the son of michaiah the son of zaccur the son of asaph,Old Testament
Ether 4:14,0.7715529540638442,"unto the house of israel ""ye shall be unto me",come unto me o ye house of israel and it,Book of Mormon
1 Chronicles 3:21,0.7715098577672561,had 3 sons and 1 daughter martered 2 sons and,and the sons of hananiah pelatiah and jesaiah the sons,Old Testament
Joshua 18:13,0.7714432322088347,south by the side of j f smith the quorum,the south side of the nether bethhoron,Old Testament
Revelation 18:7,0.7714400887843613,as a queen am no widow and shall see no,her heart i sit a queen and am no widow and shall see no sorrow,New Testament
Alma 48:17,0.771408910147277,the children and the hearts of the children to their,the hearts of the children of men,Book of Mormon
Doctrine and Covenants 64:22,0.771408910147277,the children and the hearts of the children to their,the hearts of the children of men,Doctrine and Covenants
1 Nephi 8:33,0.7714018497105655,the new jerrusalem they would point the finger of scorn,they did point the finger of scorn at me and,Book of Mormon
Isaiah 1:24,0.771303765387337,saith the lord of hosts as i the lord have,therefore saith the lord the lord of hosts the mighty,Old Testament
Matthew 25:5,0.7712110254049337,bridegroom tarried they all slumbered and slep we have all,while the bridegroom tarried they all slumbered and slept,New Testament
1 Nephi 13:37,0.7711220682610996,god and the gift of the holy ghost that they,gift and the power of the holy ghost and if,Book of Mormon
Doctrine and Covenants 135:6,0.7710939129040737,this nation in the book of mormon and doctrine and,book of mormon and this book of doctrine and covenants,Doctrine and Covenants
Doctrine and Covenants 45:44,0.7710443043936275,will come from heaven clothed with all that great glory,of heaven clothed with power and great glory with all,Doctrine and Covenants
3 Nephi 24:5,0.7709663595735574,saith the lord of hosts i the lord have spoken,not me saith the lord of hosts,Book of Mormon
Doctrine and Covenants 53:3,0.7709290904222262,by the laying on of hands we also administered to,by the laying on of hands,Doctrine and Covenants
Mark 10:23,0.77092865887916,"that have riches enter into the kingdom of god"" for",how hardly shall they that have riches enter into the kingdom of god!,New Testament
Daniel 5:23,0.7709206828723587,a god of gold silver brass iron wood or stone,the gods of silver and gold of brass iron wood,Old Testament
1 Nephi 13:37,0.7708412598881943,upon you the gift of the holy ghost and we,gift and the power of the holy ghost and if,Book of Mormon
Luke 22:30,0.7708331279174578,thrones judging the twelve tribes of israel so i say,my kingdom and sit on thrones judging the twelve tribes of israel,New Testament
Doctrine and Covenants 25:13,0.7707734320771868,fulfill thy covenants o god which thou hast made with,the covenants which thou hast made,Doctrine and Covenants
Abraham 1:7,0.7707444981533857,a priest and in the afternoon several of the priest,elkenah the priest of elkenah was also the priest of pharaoh,Pearl of Great Price
Judges 4:6,0.7706312455521288,to the children and the hearts of the children to,the children of naphtali and of the children of zebulun,Old Testament
Ezra 2:6,0.7706312455521288,to the children and the hearts of the children to,the children of pahathmoab of the children of jeshua and,Old Testament
Nehemiah 7:11,0.7706312455521288,to the children and the hearts of the children to,the children of pahathmoab of the children of jeshua and,Old Testament
Judges 4:6,0.7706312455521288,to the children and the hearts of the children to,the children of naphtali and of the children of zebulun,Old Testament
Nehemiah 7:11,0.7706312455521288,to the children and the hearts of the children to,the children of pahathmoab of the children of jeshua and,Old Testament
Ezra 2:6,0.7706312455521288,to the children and the hearts of the children to,the children of pahathmoab of the children of jeshua and,Old Testament
2 Nephi 33:1,0.770598909063226,in the spirit and power of the holy ghost now,the power of the holy ghost the power of the,Book of Mormon
Doctrine and Covenants 20:39,0.7705385616303675,the young men together and ordain priests teachers and deacons,and to ordain other elders priests teachers and deacons,Doctrine and Covenants
2 Nephi 31:17,0.7705201511432506,of your sins and recieve the holy ghost by the,of your sins by fire and by the holy ghost,Book of Mormon
2 Nephi 33:1,0.770467691311648,power of god and the holy ghost we have to,the power of the holy ghost the power of the,Book of Mormon
Mosiah 21:31,0.7704608861113232,to all and who serve god and keep his commandments,covenant with god to serve him and keep his commandments,Book of Mormon
Doctrine and Covenants 101:11,0.7704437631645851,when their cup of iniquity is full cloth thy saints,cup of their iniquity is full,Doctrine and Covenants
1 Chronicles 4:21,0.7703692516561325,his father and say o my father and his father,the father of lecah and laadah the father of mareshah,Old Testament
Doctrine and Covenants 128:18,0.7702900306245409,they could not be made perfect nor we without them,they nor we be made perfect without those who have,Doctrine and Covenants
Song of Solomon 2:15,0.7702756923720994,is the little foxes that spoil the vines we have,take us the foxes the little foxes that spoil the,Old Testament
1 Kings 13:34,0.7702077151220265,to destroy us from off the face of the earth,off the face of the earth,Old Testament
1 Chronicles 8:40,0.7702055664620877,we met with 3 sons and 2 sons in law,archers and had many sons and sons' sons an hundred,Old Testament
Joseph Smith--Matthew 1:35,0.7701529712529044,not pass away but shall all be fulfilled saith the,pass away yet my words shall not pass away but all shall be fulfilled,Pearl of Great Price
1 Chronicles 24:26,0.7700004179008539,we met with 3 sons and 2 sons in law,the sons of merari were mahli and mushi the sons of jaaziah beno,Old Testament
Doctrine and Covenants 136:1,0.7699517417190604,word of the lord concerning the camp and expressed his,the word and will of the lord concerning the camp,Doctrine and Covenants
3 Nephi 24:11,0.7698305554347419,saith the lord of hosts as i the lord have,the fields saith the lord of hosts,Book of Mormon
2 Nephi 1:21,0.7698238818084225,make us of one heart and mind in all things,one mind and in one heart united in all things,Book of Mormon
Doctrine and Covenants 128:21,0.7697801992835188,of the church of jesus christ of latterday saints met,tribulations of this church of jesus christ of latterday saints!,Doctrine and Covenants
Doctrine and Covenants 128:21,0.7697801992835188,of the church of jesus christ of latterday saints met,tribulations of this church of jesus christ of latterday saints!,Doctrine and Covenants
Doctrine and Covenants 132:19,0.7694944201761938,and endowment of the new and everlasting covenant 2 home,and by the new and everlasting covenant and it is,Doctrine and Covenants
Proverbs 30:9,0.7694162976472015,will take the name of god in vain he will,and take the name of my god in vain,Old Testament
Doctrine and Covenants 27:9,0.769400521739525,of the fathers to the children and the children to,to the children and the hearts of the children to,Doctrine and Covenants
Alma 56:28,0.769345454336392,have left their wives wives their husbands children their parents,for their wives and their children,Book of Mormon
Ezra 2:42,0.769194721277887,the children and the hearts of the children to their,akkub the children of hatita the children of shobai in,Old Testament
Daniel 5:4,0.7691937239845115,a god of gold silver brass iron wood or stone,of silver of brass of iron of wood and of stone,Old Testament
Moses 7:50,0.7691163409596873,unto the lord and we ask thee o god the,unto the lord saying i ask thee o lord in,Pearl of Great Price
Revelation 16:3,0.769053789851625,the third angel poured out his vial upon the rivers,and the second angel poured out his vial upon the,New Testament
Mosiah 6:1,0.7689994686939496,to be faithful to god and keep his commandments for,with god to keep his commandments,Book of Mormon
Alma 9:2,0.768968251707633,should pass away his words should not pass away but,that the earth should pass away,Book of Mormon
Doctrine and Covenants 10:21,0.7689027140022604,love darkness rather than the light because their deeds are,abominations and they love darkness rather than light because their,Doctrine and Covenants
Numbers 6:11,0.7688126762510511,offering to the lord i will make an offering to,offering and the other for a burnt offering and make,Old Testament
Doctrine and Covenants 53:3,0.7687669359349854,by the laying on of hands i then visited daniel,by the laying on of hands,Doctrine and Covenants
Doctrine and Covenants 33:15,0.7687533499290536,by the laying on of hands and prayer we were,by the laying on of the hands and i will,Doctrine and Covenants
Mark 16:16,0.7687013790669623,that believeth it may be saved and he that believeth,he that believeth and is baptized shall be saved but,New Testament
2 Nephi 29:13,0.7686705427524321,of the ten lost tribes of israel we shall get,of israel and the lost tribes of israel shall have,Book of Mormon
Ecclesiastes 7:2,0.7686061762682944,to go [to] the house of mourning than to the,it is better to go to the house of mourning,Old Testament
Doctrine and Covenants 128:17,0.7685436673301083,"""and he shall turn the hearts of the fathers to",he shall turn the heart of the fathers to the,Doctrine and Covenants
John 6:69,0.7685430960098598,christ the son of the living god that mormonism will,christ the son of the living god,New Testament
1 Chronicles 16:2,0.768517042880264,in the name of the lord i then walked to,in the name of the lord,Old Testament
Matthew 23:39,0.768517042880264,in the name of the lord i then walked to,in the name of the lord,New Testament
2 John 1:3,0.768458868839463,god the father and his son jesus christ and to,father and from the lord jesus christ the son of,New Testament
Numbers 27:23,0.7684198811936056,laid his hands upon him and blessed him ** see,and he laid his hands upon him and gave him,Old Testament
3 Nephi 11:25,0.7681172026776553,the son and the son in the father in the,in the name of the father and of the son,Book of Mormon
Doctrine and Covenants 20:73,0.7681172026776553,the son and the son in the father in the,in the name of the father and of the son,Doctrine and Covenants
