verse_title,cosine_score,phrase_woodruff,phrase_scripture,volume_title
Doctrine and Covenants 136:20,0.7421785506515959,be made manifes[t] seek ye and keep all your pledges,seek ye and keep all your pledges one with another,Doctrine and Covenants
Exodus 15:26,0.7421511793038055,to keep all the commandments and statutes of the lord,his commandments and keep all his statutes i will put,Old Testament
Jeremiah 36:14,0.7420507827384565,the son and the son in the father in the,the son of shelemiah the son of cushi unto baruch,Old Testament
1 Chronicles 7:17,0.7420367463271308,we met with 3 sons and 2 sons in law,and the sons of ulam bedan these were the sons,Old Testament
Revelation 1:9,0.7419039868793242,^him^ as he was upon the isle of patmos with,was in the isle that is called patmos for the,New Testament
Doctrine and Covenants 120:1,0.7418792029831809,the first presidency of the church and at the head,of the first presidency of my church and of the,Doctrine and Covenants
Deuteronomy 1:3,0.7418787302671248,on this seventh month the first day of the month,the eleventh month on the first day of the month,Old Testament
Matthew 8:12,0.7418741725600417,the ^gentiles^ children of the kingdom will be cast out,but the children of the kingdom shall be cast out,New Testament
Psalms 123:3,0.7418736781455734,night god have mercy upon us [figure] i signed 4,have mercy upon us o lord have mercy upon us,Old Testament
Mosiah 7:19,0.7418544765448802,of abraham and of isaac and of jacob i am,of abraham and isaac and jacob and also that god,Book of Mormon
1 Chronicles 6:58,0.741843995524496,with her and with her child which was the case,and hilen with her suburbs debir with her suburbs,Old Testament
Joshua 21:34,0.741843995524496,with her and with her child which was the case,jokneam with her suburbs and kartah with her suburbs,Old Testament
1 Chronicles 6:80,0.741843995524496,with her and with her child which was the case,with her suburbs and mahanaim with her suburbs,Old Testament
1 Chronicles 6:71,0.741843995524496,with her and with her child which was the case,with her suburbs and ashtaroth with her suburbs,Old Testament
Mosiah 18:34,0.7418374129559133,the coming of the son of man i the lord,of the lord were apprised of the coming of the,Book of Mormon
Doctrine and Covenants 98:13,0.7417581753457183,for my sake for he that layeth down his life,and whoso layeth down his life in my cause for,Doctrine and Covenants
Doctrine and Covenants 98:13,0.7417581753457183,down his life for my sake for he that layeth,and whoso layeth down his life in my cause for,Doctrine and Covenants
Doctrine and Covenants 128:18,0.7417079261517542,that they without us could not be made perfect neither,neither can they without us be made perfect neither can,Doctrine and Covenants
Doctrine and Covenants 51:4,0.7416431196911348,not church animals they belong to members of the church,of the church to belong to the church,Doctrine and Covenants
Acts 27:12,0.7415850867891882,the evening from the west and north west tuesday 17th,the south west and north west,New Testament
Doctrine and Covenants 128:21,0.7415308304618585,church of jesus christ of latterday saints met at the,tribulations of this church of jesus christ of latterday saints!,Doctrine and Covenants
Doctrine and Covenants 124:3,0.7414511686179885,this is the proclamation to all the kings of world,this proclamation shall be made to all the kings of,Doctrine and Covenants
Nehemiah 9:12,0.7413948170640692,pillar of fire by night and cloud by day and,pillar and in the night by a pillar of fire,Old Testament
3 Nephi 22:17,0.741353036175544,in gods own time no weapon shall prosper against thee,no weapon that is formed against thee shall prosper and,Book of Mormon
Isaiah 54:17,0.741353036175544,in gods own time no weapon shall prosper against thee,no weapon that is formed against thee shall prosper and,Old Testament
2 Chronicles 12:5,0.7413260589216545,who is in heaven and thus saith the lord unto,of shishak and said unto them thus saith the lord,Old Testament
Moroni 6:4,0.7413004798212794,had to keep a guard over them to keep them,to keep them in the right way to keep them,Book of Mormon
Joseph Smith--History 1:34,0.7412806865578079,of the fulness of the everlasting gospel in the city,said that the fulness of the everlasting gospel was contained,Pearl of Great Price
Doctrine and Covenants 68:25,0.7412674139117604,holy ghost and the gift of the holy ghost cornelius,and the gift of the holy ghost by the laying,Doctrine and Covenants
Doctrine and Covenants 124:125,0.7411747913945133,the first apostle prophet seer and revelator called in these,a revelator a seer and prophet,Doctrine and Covenants
Doctrine and Covenants 128:21,0.7410875699070532,the church of jesus christ of latterday saints and many,tribulations of this church of jesus christ of latterday saints!,Doctrine and Covenants
Jacob 5:69,0.7410837349960225,the nations of the earth to prune the vineyard once,this once will i prune my vineyard,Book of Mormon
1 Chronicles 2:31,0.7410498141269263,with the children all the children over 8 years of,ishi sheshan and the children of sheshan ahlai,Old Testament
Mosiah 17:11,0.7410284519250439,that he feared none of the judgments of god for,he feared his word for he feared that the judgments,Book of Mormon
Haggai 2:23,0.7409802443882813,i will burn them up saith the lord of hosts,in that day saith the lord of hosts will i,Old Testament
Moroni 3:3,0.7408502736884495,upon you in the name of jesus christ and we,in the name of jesus christ i ordain you to,Book of Mormon
3 Nephi 20:13,0.7408343854174887,together from the the east west north and south many,the east and from the west and from the south,Book of Mormon
Doctrine and Covenants 29:2,0.7407549181385085,at the door call upon the lord in mighty prayer,call upon me in mighty prayer,Doctrine and Covenants
Genesis 18:25,0.7407192462082176,wicked will slay the wicked slay the wicked until the,to slay the righteous with the wicked and that the,Old Testament
Moroni 10:26,0.7406898425811849,die but if they die in the lord they are,and die for they die in their sins and they,Book of Mormon
2 Peter 1:21,0.7406765356517551,been moved upon by the power of the holy ghost,they were moved by the holy ghost,New Testament
Joseph Smith--History 1:14,0.7406593243637276,this day for the first time in my life i,was the first time in my life that i had,Pearl of Great Price
Jeremiah 25:26,0.7406524145923408,upon the face of the earth and that the holy,which are upon the face of the earth and the,Old Testament
Hebrews 12:1,0.7405656147400008,doth so easily beset us and rum for the prize,and the sin which doth so easily beset us and,New Testament
Doctrine and Covenants 110:15,0.7405422194497748,answer is to turn the hearts of the children to,to turn the hearts of the fathers to the children,Doctrine and Covenants
Numbers 20:17,0.740441979656655,not turn to the right hand or left if you,not turn to the right hand nor to the left,Old Testament
2 Chronicles 34:30,0.7404323617741668,in the [[house of the lord|house of the lord]] in,that was found in the house of the lord,Old Testament
Doctrine and Covenants 99:1,0.74026024099507,son thus saith the lord god unto thee my servant,behold thus saith the lord unto my servant john murdockthou,Doctrine and Covenants
Moses 3:5,0.7402276495020674,of god when the lord created the earth or any,the earth and i the lord god had created all,Pearl of Great Price
Doctrine and Covenants 88:136,0.7401985126656182,of the prophets|school of the prophets]] in the afternoon several,house of god in the school of the prophets,Doctrine and Covenants
Deuteronomy 8:20,0.7401436818706195,the voice of the spirit of the lord was unto,unto the voice of the lord your god,Old Testament
3 Nephi 10:5,0.7401352578911599,all ye house of israel and all ye nations of,yea o ye people of the house of israel ye,Book of Mormon
Doctrine and Covenants 112:30,0.7401280474179912,dispensation and fulness of times concerning my church which has,which is the dispensation of the fulness of times,Doctrine and Covenants
John 3:19,0.7401166914066964,"""this is the condemnation of the world that light has",and this is the condemnation that light is come into,New Testament
Doctrine and Covenants 28:6,0.7400662183270404,a head and that head is the twelve and we,head and at the head of the church,Doctrine and Covenants
Deuteronomy 24:20,0.7399621419217034,the widow and the fatherless come not up into the,for the fatherless and for the widow,Old Testament
Deuteronomy 24:21,0.7399621419217034,the widow and the fatherless come not up into the,for the fatherless and for the widow,Old Testament
Psalms 146:1,0.7399535395259447,and trust in him praise the lord o my soul,praise ye the lord praise the lord o my soul,Old Testament
Doctrine and Covenants 88:95,0.7399426123435273,the face of the lord will be unveiled and the,it is rolled up and the face of the lord shall be unveiled,Doctrine and Covenants
Jeremiah 13:11,0.7398765861756049,this people for which i feel to praise the name,a people and for a name and for a praise,Old Testament
Doctrine and Covenants 127:12,0.7398549664858706,of church of jesus christ of latterday saints met this,lord prophet and seer of the church of jesus christ of latterday saints,Doctrine and Covenants
1 Chronicles 26:15,0.7398507685599299,into the house of one of his sons with his,to obededom southward and to his sons the house of asuppim,Old Testament
Doctrine and Covenants 33:15,0.7398255555746442,him by prayer and the laying on of hands tuesday,by the laying on of the hands and i will,Doctrine and Covenants
Exodus 7:20,0.7397837477668011,favor in the sight of god and his servants i,and in the sight of his servants and all the,Old Testament
Doctrine and Covenants 136:7,0.7397755268411847,farming utensils to go as pioneers to prepare for puting,and farming utensils to go as pioneers to prepare for putting in spring crops,Doctrine and Covenants
Doctrine and Covenants 106:5,0.7397744453519628,ity before me! therefore gird up the loins of your,therefore gird up your loins that you may be the,Doctrine and Covenants
Moses 6:4,0.7397589380506916,blessed them in the name of the lord he blessed,of the lord and the lord blessed them,Pearl of Great Price
Numbers 26:23,0.7396585554689383,family and all the smith family the heads of the,the family of the tolaites of pua the family of the punites,Old Testament
Numbers 26:48,0.7396585554689383,family and all the smith family the heads of the,the family of the jahzeelites of guni the family of the gunites,Old Testament
3 Nephi 1:13,0.7395557083869625,spoken of by all the holy prophets will be among,be spoken by the mouth of my holy prophets,Book of Mormon
Jacob 1:4,0.7395468184731502,my sake and for the sake of christ and the,for the sake of our people,Book of Mormon
Deuteronomy 28:61,0.7395307787269889,for the book of the law of the lord from,in the book of this law them will the lord,Old Testament
2 Nephi 33:1,0.7395045461224777,power of the holy ghost now any of the rest,the power of the holy ghost the power of the,Book of Mormon
Doctrine and Covenants 20:35,0.739486737352369,the power of god and the gift of the holy,gift and power of the holy ghost the voice of,Doctrine and Covenants
Nehemiah 13:29,0.7393724258870642,the priesthood and the priesthood that he received and the,priesthood and the covenant of the priesthood and of the levites,Old Testament
2 Nephi 5:30,0.739344128860747,heber had said so it came to pass the lord,and it came to pass that the lord god said,Book of Mormon
Numbers 27:23,0.7393398557076067,we laid hands upon him and blessed him w woodruff,and he laid his hands upon him and gave him,Old Testament
Mark 13:27,0.7393394407224003,the office a part of the day and part of,part of the earth to the uttermost part of heaven,New Testament
1 Chronicles 11:10,0.7393348020489263,of my church to the word of the lord concerning,the word of the lord concerning israel,Old Testament
Matthew 23:39,0.7392424360912861,the priesthood in the name of the lord god which,in the name of the lord,New Testament
1 Chronicles 16:2,0.7392424360912861,the priesthood in the name of the lord god which,in the name of the lord,Old Testament
2 Chronicles 33:15,0.7392249994660817,in the [[house of the lord|house of the lord]] in,out of the house of the lord and all the,Old Testament
Ephesians 1:17,0.7390787737463945,father of our lord jesus christ and in his name,that the god of our lord jesus christ the father,New Testament
Ezekiel 45:3,0.7390627161456848,that it may be the most holy place for the,and in it shall be the sanctuary and the most holy place,Old Testament
Job 37:3,0.7390601198063478,the people of god from the ends of the earth,unto the ends of the earth,Old Testament
Doctrine and Covenants 63:36,0.7390087386726534,upon the face of the earth and that the holy,things upon the face of the earth i will that,Doctrine and Covenants
Doctrine and Covenants 109:50,0.738982822030655,the prophets and that they may cease to spoil and,driven thy people that they may cease to spoil that,Doctrine and Covenants
Mosiah 15:24,0.7389651686197394,arise in the first resurrection and have part in a,and they have a part in the first resurrection or,Book of Mormon
Doctrine and Covenants 88:85,0.7389093135809746,garments are clean from the blood of the inhabitants of,their garments are not clean from the blood of this generation,Doctrine and Covenants
Doctrine and Covenants 53:3,0.7388365413805815,persons by the laying on of hands and anointing with,by the laying on of hands,Doctrine and Covenants
1 Chronicles 2:31,0.7388358841116061,fathers to the children and the hearts of the children,ishi sheshan and the children of sheshan ahlai,Old Testament
Doctrine and Covenants 124:69,0.7388092653765131,held the power of government from generation to generation and,his generation after him from generation to generation so long,Doctrine and Covenants
Moroni 6:9,0.7387984076796761,holy ghost and the power of god while at the,power of the holy ghost for as the power of,Book of Mormon
Doctrine and Covenants 115:4,0.7387754120721772,church of jesus christ of latterday saints it is 40,days even the church of jesus christ of latterday saints,Doctrine and Covenants
Doctrine and Covenants 35:2,0.7387113571120204,i am in the father and the father in me,am one in the father as the father is one,Doctrine and Covenants
Ezekiel 11:24,0.738710139128292,only by the spirit of god or by vision we,a vision by the spirit of god into chaldea to,Old Testament
Joseph Smith--History 1:69,0.7386689047610876,the baptism of repentance for remission of sins and the,repentance and of baptism by immersion for the remission of,Pearl of Great Price
Doctrine and Covenants 13:1,0.7386689047610876,the baptism of repentance for remission of sins and the,repentance and of baptism by immersion for the remission of,Doctrine and Covenants
1 Chronicles 7:20,0.7386632581982034,his son wilford smith woodruff and his son charles wilford,and tahath his son and eladah his son and tahath his son,Old Testament
Doctrine and Covenants 98:16,0.7386417932201443,children to the fathers and fathers to the children now,the hearts of the fathers to the children,Doctrine and Covenants
2 Nephi 33:1,0.7386335810746183,the power of the holy ghost rest upon us we,the power of the holy ghost the power of the,Book of Mormon
Doctrine and Covenants 127:12,0.7385000005651513,church of jesus christ of latterday saints met at the,lord prophet and seer of the church of jesus christ of latterday saints,Doctrine and Covenants
Numbers 32:33,0.7384180220465517,of the kingdom of the kingdom of god and the,of sihon king of the amorites and the kingdom of,Old Testament
Malachi 1:13,0.7383770924195151,saith the lord of hosts i the lord have spoken,ye have snuffed at it saith the lord of hosts,Old Testament
2 Nephi 28:28,0.7383651813908054,mormon and was angry because of the truth of god,are angry because of the truth of god! for behold,Book of Mormon
Revelation 16:8,0.7383424736519206,the third angel poured out his vial upon the rivers,and the fourth angel poured out his vial upon the,New Testament
1 Chronicles 6:30,0.738300745783014,his son wilford smith woodruff and his son charles wilford,shimea his son haggiah his son asaiah his son,Old Testament
1 Chronicles 7:26,0.738300745783014,his son wilford smith woodruff and his son charles wilford,laadan his son ammihud his son elishama his son,Old Testament
1 Chronicles 3:12,0.738300745783014,his son wilford smith woodruff and his son charles wilford,amaziah his son azariah his son jotham his son,Old Testament
1 Chronicles 6:27,0.738300745783014,his son wilford smith woodruff and his son charles wilford,eliab his son jeroham his son elkanah his son,Old Testament
1 Chronicles 3:11,0.738300745783014,his son wilford smith woodruff and his son charles wilford,joram his son ahaziah his son joash his son,Old Testament
1 Chronicles 6:51,0.738300745783014,his son wilford smith woodruff and his son charles wilford,bukki his son uzzi his son zerahiah his son,Old Testament
1 Chronicles 4:25,0.738300745783014,his son wilford smith woodruff and his son charles wilford,shallum his son mibsam his son mishma his son,Old Testament
1 Chronicles 6:53,0.738300745783014,his son wilford smith woodruff and his son charles wilford,zadok his son ahimaaz his son,Old Testament
1 Chronicles 6:52,0.738300745783014,his son wilford smith woodruff and his son charles wilford,meraioth his son amariah his son ahitub his son,Old Testament
Jeremiah 23:7,0.7382921429641254,ot took the children of israel out of egypt into,the children of israel out of the land of egypt,Old Testament
Doctrine and Covenants 109:4,0.738282758728714,the eternal father we ask thee in the name of,and now we ask thee holy father in the name,Doctrine and Covenants
Acts 19:15,0.7381764668579762,i know and christ i know but who are ye,and paul i know but who are ye,New Testament
Numbers 26:12,0.7381618992675447,family and all the smith family the heads of the,family of the nemuelites of jamin the family of the,Old Testament
Numbers 26:15,0.7381618992675447,family and all the smith family the heads of the,family of the zephonites of haggi the family of the,Old Testament
Numbers 26:26,0.7381618992675447,family and all the smith family the heads of the,the family of the sardites of elon the family of,Old Testament
Numbers 26:44,0.7381618992675447,family and all the smith family the heads of the,the family of the jimnites of jesui the family of,Old Testament
Hebrews 11:40,0.7381525975866716,us they could not be made perfect nor we without,without us should not be made perfect,New Testament
Deuteronomy 34:5,0.7380702068416793,upon joseph land and the the word of the lord,the land of moab according to the word of the lord,Old Testament
1 Chronicles 11:39,0.737976845495868,the son and the son in the father in the,zelek the ammonite naharai the berothite the armourbearer of joab the son of zeruiah,Old Testament
3 Nephi 10:4,0.7376966286179978,gathereth her chickens under her wings but they would not,a hen gathereth her chickens under her wings and have nourished you,Book of Mormon
Luke 1:17,0.7374868834390785,he shall turn the hearts of the fathers to the,power of elias to turn the hearts of the fathers,New Testament
Luke 1:17,0.7374868834390785,he shall turn the hearts of the fathers to the,power of elias to turn the hearts of the fathers,New Testament
Doctrine and Covenants 68:11,0.7373925371832847,of the signs of the times i wrote 1 letter,signs of the times and the signs of the coming of the son of man,Doctrine and Covenants
Hebrews 11:1,0.7373922616358793,the evidence of things ^not seen^hoped for g what do,now faith is the substance of things hoped for the evidence of things not seen,New Testament
Exodus 2:24,0.737316936458878,with all the blessings of abraham isaac and jacob in,with abraham with isaac and with jacob,Old Testament
Acts 1:3,0.737217135573748,in regard to things pertaining to the kingdom of god,and speaking of the things pertaining to the kingdom of god,New Testament
Ether 9:33,0.7372167389825602,and hedge up the way of our enemies that they,that they should hedge up the way that the people,Book of Mormon
Numbers 23:9,0.7372123022159257,feet from the top of the rocks and from the,for from the top of the rocks i see him,Old Testament
2 Nephi 33:1,0.7372078006194586,be so full of the holy ghost and the power,the power of the holy ghost the power of the,Book of Mormon
Joshua 10:14,0.7371894487347638,the voice of the spirit of the lord was unto,after it that the lord hearkened unto the voice of,Old Testament
Doctrine and Covenants 115:3,0.7371487316061357,of the church of jesus christ of latterday saints in,of my church of jesus christ of latterday saints scattered abroad in all the world,Doctrine and Covenants
Doctrine and Covenants 127:9,0.7369129469410624,saith the lord of hosts i the lord have spoken,generation saith the lord of hosts,Doctrine and Covenants
Nehemiah 7:54,0.7369027010509394,fathers to the children and the hearts of the children,the children of bazlith the children of mehida the children of harsha,Old Testament
Nehemiah 7:56,0.7369027010509394,fathers to the children and the hearts of the children,the children of neziah the children of hatipha,Old Testament
Ezra 2:44,0.7369027010509394,fathers to the children and the hearts of the children,the children of keros the children of siaha the children of padon,Old Testament
Ezra 2:50,0.7369027010509394,fathers to the children and the hearts of the children,the children of asnah the children of mehunim the children of nephusim,Old Testament
Ezra 2:46,0.7369027010509394,fathers to the children and the hearts of the children,the children of hagab the children of shalmai the children of hanan,Old Testament
Nehemiah 7:58,0.7369027010509394,fathers to the children and the hearts of the children,the children of jaala the children of darkon the children of giddel,Old Testament
Ezra 2:49,0.7369027010509394,fathers to the children and the hearts of the children,the children of uzza the children of paseah the children of besai,Old Testament
Ezra 2:48,0.7369027010509394,fathers to the children and the hearts of the children,the children of rezin the children of nekoda the children of gazzam,Old Testament
Nehemiah 7:48,0.7369027010509394,fathers to the children and the hearts of the children,the children of lebana the children of hagaba the children of shalmai,Old Testament
Nehemiah 7:50,0.7369027010509394,fathers to the children and the hearts of the children,the children of reaiah the children of rezin the children of nekoda,Old Testament
Nehemiah 7:53,0.7369027010509394,fathers to the children and the hearts of the children,the children of bakbuk the children of hakupha the children of harhur,Old Testament
Ezra 2:51,0.7369027010509394,fathers to the children and the hearts of the children,the children of bakbuk the children of hakupha the children of harhur,Old Testament
Nehemiah 7:52,0.7369027010509394,fathers to the children and the hearts of the children,the children of besai the children of meunim the children of nephishesim,Old Testament
Ezra 2:52,0.7369027010509394,fathers to the children and the hearts of the children,the children of bazluth the children of mehida the children of harsha,Old Testament
Ezra 2:54,0.7369027010509394,fathers to the children and the hearts of the children,the children of neziah the children of hatipha,Old Testament
Nehemiah 7:49,0.7369027010509394,fathers to the children and the hearts of the children,the children of hanan the children of giddel the children of gahar,Old Testament
Ezra 2:47,0.7369027010509394,fathers to the children and the hearts of the children,the children of giddel the children of gahar the children of reaiah,Old Testament
Nehemiah 7:51,0.7369027010509394,fathers to the children and the hearts of the children,the children of gazzam the children of uzza the children of phaseah,Old Testament
Ezra 2:45,0.7369027010509394,fathers to the children and the hearts of the children,the children of lebanah the children of hagabah the children of akkub,Old Testament
Nehemiah 7:47,0.7369027010509394,fathers to the children and the hearts of the children,the children of keros the children of sia the children of padon,Old Testament
Nehemiah 7:55,0.7369027010509394,fathers to the children and the hearts of the children,the children of barkos the children of sisera the children of tamah,Old Testament
Ezra 2:56,0.7369027010509394,fathers to the children and the hearts of the children,the children of jaalah the children of darkon the children of giddel,Old Testament
Ezra 2:53,0.7369027010509394,fathers to the children and the hearts of the children,the children of barkos the children of sisera the children of thamah,Old Testament
1 Chronicles 4:2,0.7368192968202671,but not a tabernacle who begat the son of god,and reaiah the son of shobal begat jahath and jahath,Old Testament
Doctrine and Covenants 90:6,0.7367991266872289,chosen to bear the keys of this last kingdom was,the keys of this last kingdom,Doctrine and Covenants
Acts 18:17,0.7367405780176013,cared for none of these things we next called upon,gallio cared for none of those things,New Testament
Doctrine and Covenants 110:15,0.7367323797994809,children and the hearts of the children unto the fathers,to turn the hearts of the fathers to the children,Doctrine and Covenants
Articles of Faith 1:8,0.7367187770756605,that the book of mormon is the book of god,the book of mormon to be the word of god,Pearl of Great Price
1 Kings 10:12,0.736665369505154,in the [[house of the lord|house of the lord]] in,the house of the lord and for the king's house,Old Testament
Joseph Smith--History 1:70,0.7366519031549025,of god and the gift of the holy ghost the,laying on hands for the gift of the holy ghost,Pearl of Great Price
