verse_title,cosine_score,phrase_woodruff,phrase_scripture,volume_title
Ruth 1:1,0.7945679075865097,to a certain man in a certain street and he,and a certain man of bethlehemjudah went to sojourn in,Old Testament
Psalms 144:15,0.7945446477386457,expected happy is that people whose god is the lord,yea happy is that people whose god is the lord,Old Testament
Doctrine and Covenants 76:52,0.7943988853967006,to him by the laying on of hands also to,by the laying on of the hands of him who,Doctrine and Covenants
Nehemiah 12:22,0.7943898238051897,lived in the days of joseph and in the days,the levites in the days of eliashib joiada and johanan,Old Testament
Revelation 1:9,0.79418739464747,of god and the testimony of jesus christ o lord,word of god and for the testimony of jesus christ,New Testament
Judges 21:11,0.7940844437212858,do ye strive o! ye gentiles for this thing ye,and this is the thing that ye shall do ye,Old Testament
Doctrine and Covenants 63:53,0.7939846663514205,of the coming of the son of man and may,even in the day of the coming of the son of man,Doctrine and Covenants
Doctrine and Covenants 136:17,0.7939648404643135,you and fear not thine enemies for they shall not,and fear not thine enemies for they shall not have power to stop my work,Doctrine and Covenants
Doctrine and Covenants 45:25,0.7939370672592171,the times of the gentiles be fulfilled which has been,until the times of the gentiles be fulfilled,Doctrine and Covenants
Joshua 8:34,0.7937755069089105,for the book of the law of the lord from,in the book of the law,Old Testament
Acts 19:17,0.7937605052028148,and i ask the lord in the name of jesus,and the name of the lord jesus was magnified,New Testament
Doctrine and Covenants 124:125,0.7937395609511185,the mouth of the prophet seer revelator president and law,a revelator a seer and prophet,Doctrine and Covenants
Ezra 10:9,0.7937170063018262,on this seventh month the first day of the month,month on the twentieth day of the month and all,Old Testament
Revelation 3:8,0.7936541876981165,man can shut and shut and no man can open,an open door and no man can shut it for,New Testament
Alma 5:4,0.7935756762961437,be by the power and mercy of god brother joseph,the mercy and power of god,Book of Mormon
Doctrine and Covenants 76:52,0.793524303378143,administered to him by the laying on of hands i,by the laying on of the hands of him who,Doctrine and Covenants
Doctrine and Covenants 98:16,0.7934905261873817,and the hearts of the children to the fathers sanctify,the hearts of the fathers to the children,Doctrine and Covenants
Doctrine and Covenants 1:30,0.7934173302871823,in this day to lay the foundation of this church,have power to lay the foundation of this church and,Doctrine and Covenants
1 Chronicles 12:23,0.7932461347831803,^the^ lord when giving the word of the lord to,to the word of the lord,Old Testament
Doctrine and Covenants 68:19,0.7931550855695,melchizedek priesthood from an elder to the presidency of the,of the first presidency of the melchizedek priesthood,Doctrine and Covenants
Doctrine and Covenants 136:26,0.7931428883465657,shalt deliver it to him again thou shall be diligent,thou shalt make diligent search till thou shalt deliver it to him again,Doctrine and Covenants
2 Kings 25:23,0.7929349941458947,the son and the son in the father in the,and seraiah the son of tanhumeth the netophathite and jaazaniah,Old Testament
1 Chronicles 23:21,0.7927783617261477,we met with 3 sons and 2 sons in law,the sons of merari mahli and mushi the sons of mahli eleazar and kish,Old Testament
Numbers 26:8,0.7927783617261477,we met with 3 sons and 2 sons in law,and the sons of pallu eliab,Old Testament
1 Chronicles 2:5,0.7927783617261477,we met with 3 sons and 2 sons in law,the sons of pharez hezron and hamul,Old Testament
1 Chronicles 3:22,0.7927783617261477,we met with 3 sons and 2 sons in law,and the sons of shechaniah shemaiah and the sons of,Old Testament
1 Chronicles 2:31,0.7927783617261477,we met with 3 sons and 2 sons in law,and the sons of appaim ishi and the sons of,Old Testament
1 Chronicles 2:28,0.7927783617261477,we met with 3 sons and 2 sons in law,the sons of shammai nadab and abishur,Old Testament
1 Chronicles 7:3,0.7927783617261477,we met with 3 sons and 2 sons in law,and the sons of uzzi izrahiah and the sons of,Old Testament
Moses 5:58,0.7926848861322764,the holy ghost and the gift of eternal life it,the gift of the holy ghost,Pearl of Great Price
1 Samuel 24:18,0.7925329915756514,thou hast spoken well i have all thou hast said,and thou hast shewed this day how that thou hast,Old Testament
Joshua 18:13,0.7923267354273945,snow the south by the side of j f smith,the south side of the nether bethhoron,Old Testament
Doctrine and Covenants 61:35,0.7922675024269197,taylor for a wise purpose in me i have also,and this for a wise purpose in me,Doctrine and Covenants
Doctrine and Covenants 107:67,0.7921899861440291,in the evening i laying on of hands upon the,upon the church by the laying on of the hands,Doctrine and Covenants
1 Kings 13:34,0.7918645028477274,off the face of the earth but through the blessing,off the face of the earth,Old Testament
Acts 1:3,0.7918108806532795,and speaking of the things of the kingdom of god,and speaking of the things pertaining to the kingdom of god,New Testament
Jeremiah 49:26,0.7917210537560805,saith the lord of hosts i the lord have spoken,that day saith the lord of hosts,Old Testament
Doctrine and Covenants 49:25,0.7917174975834307,the children of men zion shall flourish upon the hills,zion shall flourish upon the hills and rejoice upon the,Doctrine and Covenants
1 Chronicles 4:22,0.7916839138426355,^e^ 4 ^p^ 5 ^t^ 1 ^d^ 3 and 6,and jokim and the men of chozeba and joash and,Old Testament
3 Nephi 13:10,0.7916080297641058,come and thy will be done on earth as it,thy will be done on earth as it is in heaven,Book of Mormon
Doctrine and Covenants 1:38,0.7915492182267363,i have spoken i have spoken and i excuse not,what i the lord have spoken i have spoken and,Doctrine and Covenants
Mark 14:62,0.7915489090469439,son of man stand on the right hand of power,son of man sitting on the right hand of power,New Testament
Doctrine and Covenants 136:4,0.7915401266423024,temple of the lord all the ordinances for the dead,all the ordinances of the lord,Doctrine and Covenants
Jeremiah 28:5,0.7914965595855141,presence and in the presence of others in 1832 the,the presence of the priests and in the presence of,Old Testament
Zechariah 14:3,0.7913069307847045,fight against jerrusalem and the lord shall go forth and,then shall the lord go forth and fight against those,Old Testament
2 Samuel 14:19,0.7912793000653371,not turn to the right hand or left if you,can turn to the right hand or to the left,Old Testament
Joel 3:8,0.7911673360614625,abominations for the lord god hath spoken it and it,for the lord hath spoken it,Old Testament
John 4:47,0.7911588722345901,was at the point of death and wished me to,was at the point of death,New Testament
Abraham 2:7,0.7909608859381552,shall come like a whirlwind even in an instant suddenly,by a whirlwind in an instant suddenly,Pearl of Great Price
Doctrine and Covenants 107:56,0.7908773737138036,was bowed down with age being full of the holy,and notwithstanding he was bowed down with age being full,Doctrine and Covenants
Doctrine and Covenants 121:19,0.7908704253643837,they should be severed from the ordinances of my house,they shall be severed from the ordinances of mine house,Doctrine and Covenants
Mark 13:31,0.7908350035496485,my words shall not pass away but shall be fulfilled,heaven and earth shall pass away but my words shall not pass away,New Testament
Matthew 24:35,0.7908350035496485,my words shall not pass away but shall be fulfilled,heaven and earth shall pass away but my words shall not pass away,New Testament
Luke 21:33,0.7908350035496485,my words shall not pass away but shall be fulfilled,heaven and earth shall pass away but my words shall not pass away,New Testament
Doctrine and Covenants 98:16,0.7907380566604655,hearts of the fathers may be turned to the children,the hearts of the fathers to the children,Doctrine and Covenants
Doctrine and Covenants 53:3,0.7907267412991372,him by prayer and the laying on of hands tuesday,by the laying on of hands,Doctrine and Covenants
Acts 11:16,0.790692263152563,baptized with the holy ghost and the spirit of god,be baptized with the holy ghost,New Testament
Ephesians 4:12,0.7905963570665462,perfecting of the saints the work of the ministry and,for the perfecting of the saints for the work of,New Testament
Mormon 9:7,0.7905798859388921,of tongues and interpretation of tongues and prophesy'd and we,nor speaking with tongues and the interpretation of tongues,Book of Mormon
Numbers 2:32,0.7905074623137647,a distance in all of five thousand three hundred and,hundred thousand and three thousand and five hundred and fifty,Old Testament
Doctrine and Covenants 132:22,0.7904636441031,"upon the text ""strait is the gate and narrow the",for strait is the gate and narrow the way that,Doctrine and Covenants
Doctrine and Covenants 115:4,0.790167152582659,conference of the church of jesus christ of latterday saints,days even the church of jesus christ of latterday saints,Doctrine and Covenants
Doctrine and Covenants 115:4,0.790167152582659,conference of the church of jesus christ of latterday saints,days even the church of jesus christ of latterday saints,Doctrine and Covenants
Doctrine and Covenants 115:4,0.790167152582659,conference of the church of jesus christ of latterday saints,days even the church of jesus christ of latterday saints,Doctrine and Covenants
Alma 56:28,0.7901197797972289,left their wives wives their husbands children their parents and,for their wives and their children,Book of Mormon
Psalms 8:4,0.7899992035267664,"thou art mindful of him"" it was one of the",what is man that thou art mindful of him and,Old Testament
Doctrine and Covenants 128:20,0.7899841449407631,events of the last dispensation and fulness of times in,of the dispensation of the fulness of times!,Doctrine and Covenants
Doctrine and Covenants 136:16,0.7898850191721773,they may be ready to go to a land of,be ready to go to a land of peace,Doctrine and Covenants
3 Nephi 10:5,0.7897997845613296,gathereth her chickens under her wings but they would not,a hen gathereth her chickens under her wings yea o,Book of Mormon
Doctrine and Covenants 128:18,0.7897088175870032,last dispensation of the fulness of times the church of,the ushering in of the dispensation of the fulness of,Doctrine and Covenants
Genesis 11:4,0.7893119006290666,were scattered upon the face of the whole earth yet,scattered abroad upon the face of the whole earth,Old Testament
Doctrine and Covenants 135:1,0.7891616038977082,afternoon on the testimony of the book of the book,to seal the testimony of this book and the book,Doctrine and Covenants
Doctrine and Covenants 63:58,0.7889410218114555,it is a day of warning and not of many,for this is a day of warning and not a,Doctrine and Covenants
3 Nephi 9:2,0.7886231874499045,from gentile america and wo wo wo is their doom,wo wo wo unto this people wo unto the inhabitants,Book of Mormon
John 6:69,0.7885286265178909,jesus christ the son of the living god and seal,christ the son of the living god,New Testament
Doctrine and Covenants 128:21,0.7883508962573742,of the church of jesus christ of latterday saints in,tribulations of this church of jesus christ of latterday saints!,Doctrine and Covenants
Acts 3:21,0.7877985394178775,mouths of his holy prophets since the world began this,of all his holy prophets since the world began,New Testament
Matthew 5:14,0.7877359439521353,a city on a hill that cannot be hid and,is set on an hill cannot be hid,New Testament
Exodus 10:24,0.7876955664177366,be blessed in your flocks and in your herds and,the lord only let your flocks and your herds be,Old Testament
2 Peter 1:21,0.7875581254100154,moved upon by the holy ghost and their word^s^ were,they were moved by the holy ghost,New Testament
Jeremiah 1:13,0.7873395067181204,would unto me and the word of the lord through,and the word of the lord came unto me the,Old Testament
Judges 6:13,0.7873041540645958,we delivered them into the hands of god and the,and delivered us into the hands of the midianites,Old Testament
Doctrine and Covenants 27:9,0.7872748852989441,the hearts of the fathers to the children and the,to the children and the hearts of the children to,Doctrine and Covenants
Doctrine and Covenants 20:35,0.7870492633947692,of god and the gift of the holy ghost the,gift and power of the holy ghost the voice of,Doctrine and Covenants
Doctrine and Covenants 20:35,0.7870492633947692,of god and the gift of the holy ghost the,gift and power of the holy ghost the voice of,Doctrine and Covenants
1 Kings 4:16,0.7869618913122491,the son and the son in the father in the,baanah the son of hushai was in asher and in aloth,Old Testament
Joseph Smith--History 1:1,0.7869616270754405,year of the rise of the church of jesus christ,rise and progress of the church of jesus christ of,Pearl of Great Price
Mark 10:31,0.7868143270412097,first were to be last and the last first it,but many that are first shall be last and the last first,New Testament
Doctrine and Covenants 33:15,0.7867998944313371,joseph laying on of hands laying on of hands with,by the laying on of the hands and i will,Doctrine and Covenants
Ezra 2:60,0.7865663141471922,with the children all the children over 8 years of,the children of delaiah the children of tobiah the children,Old Testament
Ezra 2:57,0.7865663141471922,with the children all the children over 8 years of,the children of shephatiah the children of hattil the children,Old Testament
Nehemiah 7:62,0.7865663141471922,with the children all the children over 8 years of,the children of delaiah the children of tobiah the children,Old Testament
Nehemiah 7:59,0.7865663141471922,with the children all the children over 8 years of,the children of shephatiah the children of hattil the children,Old Testament
Nehemiah 7:45,0.7865663141471922,with the children all the children over 8 years of,the children of talmon the children of akkub the children,Old Testament
2 Samuel 18:2,0.7865523237358655,at the hand of their son and brother is to,the hand of abishai the son of zeruiah joab's brother,Old Testament
Doctrine and Covenants 124:129,0.786357326221196,young 5 willard richards 5 and george albert smith 5,woodruff willard richards george a smith,Doctrine and Covenants
Doctrine and Covenants 128:17,0.7860515905114935,he shall turn the hearts of the fathers to the,he shall turn the heart of the fathers to the,Doctrine and Covenants
Doctrine and Covenants 128:17,0.7860515905114935,he shall turn the hearts of the fathers to the,he shall turn the heart of the fathers to the,Doctrine and Covenants
1 Chronicles 4:4,0.7860082202949463,i am in the father and the father in me,and penuel the father of gedor and ezer the father,Old Testament
Numbers 3:50,0.7859861413499243,a distance in all of five thousand three hundred and,the money a thousand three hundred and threescore and five,Old Testament
Doctrine and Covenants 53:3,0.7859486013999776,administered to her by the laying on of hands i,by the laying on of hands,Doctrine and Covenants
Doctrine and Covenants 53:3,0.7859486013999776,administered to her by the laying on of hands i,by the laying on of hands,Doctrine and Covenants
1 Kings 8:60,0.785841279347102,him and none else he is the god that we,the lord is god and that there is none else,Old Testament
Doctrine and Covenants 43:26,0.7857690772939568,and the cup of the wrath of mine indignation is,wrath of mine indignation is full,Doctrine and Covenants
1 Chronicles 29:7,0.7856848231476796,talents of brass and 100000 talents talents of iron but,talents and one hundred thousand talents of iron,Old Testament
Jeremiah 19:3,0.7856508936620433,of man again hear ye the word of the lord,and say hear ye the word of the lord o,Old Testament
Doctrine and Covenants 107:54,0.7856240683778339,blessed adam ot and called him the prince michael the,and blessed adam and called him michael the prince the archangel,Doctrine and Covenants
Philemon 1:3,0.7853685424202632,our father and the grace of jesus christ our lord,grace to you and peace from god our father and the lord jesus christ,New Testament
Joseph Smith--History 1:1,0.7853363901291248,progress of the church of jesus christ of latter day,rise and progress of the church of jesus christ of,Pearl of Great Price
Joseph Smith--History 1:1,0.7853363901291248,progress of the church of jesus christ of latter day,rise and progress of the church of jesus christ of,Pearl of Great Price
1 Nephi 3:21,0.7853343051705418,if thou are faithful in keeping the commandments of of,faithful in keeping the commandments of god,Book of Mormon
Doctrine and Covenants 136:16,0.7852407759961801,of tens and let my servants that have been appointed,and let my servants that have been appointed go and,Doctrine and Covenants
Nehemiah 11:15,0.7851516929085618,the son and the son in the father in the,son of azrikam the son of hashabiah the son of bunni,Old Testament
Zephaniah 1:1,0.7851516929085618,the son and the son in the father in the,son of cushi the son of gedaliah the son of,Old Testament
Nehemiah 11:11,0.7851516929085618,the son and the son in the father in the,son of zadok the son of meraioth the son of,Old Testament
Doctrine and Covenants 10:69,0.7850226371266019,laws and the gates of hell shall not prevail against,upon my rock and the gates of hell shall not prevail against them,Doctrine and Covenants
Doctrine and Covenants 136:6,0.7850170321493025,to prepare for those who are to tarry let each,their might to prepare for those who are to tarry,Doctrine and Covenants
Doctrine and Covenants 124:125,0.7848587515288052,priesthood even to be prophet seer and revelator in the,a revelator a seer and prophet,Doctrine and Covenants
Doctrine and Covenants 138:33,0.7846152308847913,gift of the holy ghost by the laying on of,holy ghost by the laying on of hands,Doctrine and Covenants
Doctrine and Covenants 98:16,0.7845805191755574,fathers to the children and the hearts of the children,turn the hearts of the children to their fathers and,Doctrine and Covenants
Doctrine and Covenants 127:12,0.7845228875620023,of the church of jesus christ of latterday saints in,lord prophet and seer of the church of jesus christ of latterday saints,Doctrine and Covenants
1 Corinthians 13:2,0.7844325445757955,"have the gift of prophecy"" and he then said though",and though i have the gift of prophecy and understand,New Testament
Doctrine and Covenants 63:53,0.7844080937499593,the coming of the son of man i the lord,even in the day of the coming of the son of man,Doctrine and Covenants
Jeremiah 37:13,0.7842135731187523,the son and the son in the father in the,the son of shelemiah the son of hananiah and he,Old Testament
Doctrine and Covenants 136:22,0.7839969905203013,the last days to save my people israel cease to,out in the last days to save my people israel,Doctrine and Covenants
Doctrine and Covenants 5:35,0.7839901735137939,and if thou art faithful and keep the commandments of,and if thou art faithful in keeping my commandments thou,Doctrine and Covenants
Jeremiah 25:10,0.7839809559662096,at them with the light of truth and the candle,millstones and the light of the candle,Old Testament
2 Nephi 9:9,0.7837195582860773,when he transforms himself nigh unto an angel of light,transformeth himself nigh unto an angel of light and stirreth,Book of Mormon
Doctrine and Covenants 20:1,0.7837171994401765,the kingdom of our lord and savior jesus christ will,the coming of our lord and savior jesus christ in,Doctrine and Covenants
Doctrine and Covenants 110:14,0.783658437519163,"of the great and dreadful day of the lord"" ""and",sent before the great and dreadful day of the lord come,Doctrine and Covenants
Ephesians 5:5,0.7835683224722275,of the kingdom of the kingdom of god and the,in the kingdom of christ and of god,New Testament
Isaiah 2:5,0.7835135782946641,light in the house of the lord with the quorum,in the light of the lord,Old Testament
Doctrine and Covenants 42:81,0.7834623318410828,together according to the law of god g q cannon,with according to the law of god,Doctrine and Covenants
Moses 7:65,0.7834409013796217,prepared for the coming of the son of man it,of the coming of the son of man in the,Pearl of Great Price
Doctrine and Covenants 33:15,0.7832510203556755,through him by the laying on of hands and by,by the laying on of the hands and i will,Doctrine and Covenants
Doctrine and Covenants 84:92,0.7832142164661602,in heat or in cold and bear testimony against that,water whether in heat or in cold and bear testimony,Doctrine and Covenants
Doctrine and Covenants 115:4,0.7831181039932236,of church of jesus christ of latterday saints met this,days even the church of jesus christ of latterday saints,Doctrine and Covenants
Doctrine and Covenants 107:6,0.7830252589455412,aaronic priesthood and melchizedek priesthood for the last dispensation from,melchizedek priesthood and the other is the aaronic or levitical priesthood,Doctrine and Covenants
Deuteronomy 13:9,0.7830156940410522,the hand of the people of the united states all,the hand of all the people,Old Testament
1 Corinthians 7:36,0.7828515444277111,and marry them and not let them go to the,will he sinneth not let them marry,New Testament
Doctrine and Covenants 124:77,0.7828408528788753,held the power of government from generation to generation and,and his generation after him from generation to generation,Doctrine and Covenants
Moses 5:57,0.7827547065169035,have been prepared from before the foundation of the world,from before the foundation of the world,Pearl of Great Price
Doctrine and Covenants 84:69,0.782730238686964,the eyes of the blind unstop the ears of the,blind and unstop the ears of the deaf,Doctrine and Covenants
2 Kings 14:13,0.7826939850885687,the son and the son in the father in the,the son of jehoash the son of ahaziah at bethshemesh,Old Testament
Revelation 16:3,0.7825988587580113,3 v that he poured out his vial upon the,and the second angel poured out his vial upon the,New Testament
Doctrine and Covenants 128:17,0.7824535484995714,to the fathers lest i come and smite the earth,lest i come and smite the earth with a curse,Doctrine and Covenants
1 Kings 16:13,0.7822595413547876,israel and acknowledge all his sins and the sins of,for all the sins of baasha and the sins of,Old Testament
Deuteronomy 1:15,0.7822413952246207,be organized with captains of hundreds captains of fifties and,thousands and captains over hundreds and captains over fifties and,Old Testament
Doctrine and Covenants 76:52,0.7821694890270614,him by prayer and the laying on of hands tuesday,by the laying on of the hands of him who,Doctrine and Covenants
Jeremiah 38:25,0.782114507228175,m 5 unto thee and ask thee in the name,thee and they come unto thee and say unto thee,Old Testament
Doctrine and Covenants 88:136,0.7821021962746197,house in the school of the prophets w woodruff prayed,house of god in the school of the prophets,Doctrine and Covenants
Alma 35:13,0.7820839487901067,years it was in the eighteenth year of the reign,nephites in the eighteenth year of the reign of the,Book of Mormon
Doctrine and Covenants 138:46,0.781969072437216,"of the great and dreadful day of the lord"" ""and",the great and dreadful day of the lordwere also there,Doctrine and Covenants
Doctrine and Covenants 128:18,0.7819204549730429,israel in this last dispensation and fulness of times^ and,this the dispensation of the fulness of times,Doctrine and Covenants
Doctrine and Covenants 18:18,0.7818361751654909,be baptized and you shall receive the holy ghost take,you shall receive and you shall have the holy ghost,Doctrine and Covenants
2 Chronicles 34:10,0.7818023029413346,oversight of the house of the lord and preside over,that had the oversight of the house of the lord,Old Testament
John 15:13,0.7817891321115487,love what greater love hath any man than that he,greater love hath no man than this that a man,New Testament
Nehemiah 11:13,0.7817083293003879,the son and the son in the father in the,and two and amashai the son of azareel the son,Old Testament
Doctrine and Covenants 33:15,0.781648642287989,him by the laying on of hands and we have,by the laying on of the hands and i will,Doctrine and Covenants
Jeremiah 25:10,0.7815492674970321,stand as the candle and light of the lord i,millstones and the light of the candle,Old Testament
Doctrine and Covenants 53:3,0.7813843968971269,administered to him by the laying on of hands we,by the laying on of hands,Doctrine and Covenants
Doctrine and Covenants 84:41,0.7811959712939012,no forgiveness in this world nor in the world to,in this world nor in the world to come,Doctrine and Covenants
Doctrine and Covenants 42:18,0.7811959712939012,no forgiveness in this world nor in the world to,in this world nor in the world to come,Doctrine and Covenants
3 Nephi 20:13,0.7811312593645383,from the east and from the west and that that,the east and from the west and from the south,Book of Mormon
Genesis 26:3,0.7809931416430781,was this day i will be with thee in the,sojourn in this land and i will be with thee,Old Testament
2 Nephi 33:1,0.7809092676642799,holy ghost and the power of god while at the,the power of the holy ghost the power of the,Book of Mormon
Acts 21:14,0.7808996128364947,be done the lord said i will in the last,the will of the lord be done,New Testament
Acts 7:42,0.7808991685614769,all ye house of israel and all ye nations of,of the prophets o ye house of israel have ye,New Testament
1 Kings 9:1,0.7808953802902725,for the building of the house of the lord at,building of the house of the lord and the king's,Old Testament
Doctrine and Covenants 105:4,0.7806393461602268,a celestial law until we get into a celestial kingdom,the law of the celestial kingdom,Doctrine and Covenants
