verse_title,cosine_score,phrase_woodruff,phrase_scripture,volume_title
Doctrine and Covenants 72:8,0.7144029504693806,is ordained unto this power as it is for us,ordained unto this power this is the will of the,Doctrine and Covenants
Doctrine and Covenants 52:26,0.7144025926526687,organize a company and let my servants orson pratt and,and let my servants parley p pratt and orson pratt,Doctrine and Covenants
2 Nephi 33:15,0.714388557191777,that what we seal on earth shall be sealed in,for what i seal on earth shall be brought against,Book of Mormon
Luke 4:1,0.7143797511109607,returned are full of the holy ghost and power of,and jesus being full of the holy ghost returned from,New Testament
Jeremiah 20:2,0.7143567891952872,in the [[house of the lord|house of the lord]] in,which was by the house of the lord,Old Testament
2 Peter 1:19,0.7143381343883304,then would want that more sure word of prophecy that,we have also a more sure word of prophecy whereunto,New Testament
Doctrine and Covenants 94:3,0.7143353150199077,power of god and that the work of the ministry,and for the work of the ministry of the presidency,Doctrine and Covenants
Moses 7:48,0.7142899194805189,from gentile america and wo wo wo is their doom,saying wo wo is me the mother of men i,Pearl of Great Price
John 1:9,0.7142813334898407,that cometh into the world and when a man was,that was the true light which lighteth every man that cometh into the world,New Testament
Doctrine and Covenants 124:77,0.7142712763129625,that generation what is the history of that generation it,and his generation after him from generation to generation,Doctrine and Covenants
Moses 1:38,0.7142341295074649,and though the heavens and earth should pass away my,and as one earth shall pass away and the heavens,Pearl of Great Price
Ether 12:37,0.7142319584142351,heber had said so it came to pass the lord,and it came to pass that the lord said unto,Book of Mormon
Moses 7:9,0.7142319584142351,heber had said so it came to pass the lord,and it came to pass that the lord said unto,Pearl of Great Price
Ether 3:21,0.7142319584142351,heber had said so it came to pass the lord,and it came to pass that the lord said unto,Book of Mormon
1 Nephi 17:53,0.7142319584142351,heber had said so it came to pass the lord,and it came to pass that the lord said unto,Book of Mormon
Doctrine and Covenants 107:67,0.7142263359115857,joseph laying on of hands laying on of hands with,upon the church by the laying on of the hands,Doctrine and Covenants
1 Kings 4:10,0.7141930573733997,the son and the son in the father in the,the son of hesed in aruboth to him pertained sochoh,Old Testament
1 Nephi 1:12,0.714163344413225,of the spirit of the lord was with us and,was filled with the spirit of the lord,Book of Mormon
3 Nephi 26:3,0.7141631347778293,and though the heavens and earth should pass away my,scroll and the heavens and the earth should pass away,Book of Mormon
Mosiah 18:12,0.7141514092255172,of thy will that thy servant brigham may stand in,out thy spirit upon thy servant that he may do,Book of Mormon
3 Nephi 28:10,0.7141374984181099,i am in the father and the father in me,the father and the father and i are one,Book of Mormon
Acts 2:38,0.7141075424222175,pratt in the name of the lord jesus christ of,one of you in the name of jesus christ for,New Testament
Luke 11:2,0.7141020317956003,come and thy will be done on earth as it,kingdom come thy will be done as in heaven so in earth,New Testament
2 Corinthians 2:16,0.7140332501270131,cry out lord who is sufficient for these things o,life and who is sufficient for these things,New Testament
Doctrine and Covenants 127:12,0.7139833312798116,[figure] church of jesus christ of latterday saints met in,lord prophet and seer of the church of jesus christ of latterday saints,Doctrine and Covenants
Habakkuk 2:14,0.7139428152730395,whole earth be filled with the glory and knowledge of,for the earth shall be filled with the knowledge of,Old Testament
Doctrine and Covenants 6:15,0.7138968833803185,in preserving what thou hast that thou mayest be a,these things that thou mayest know that thou hast been,Doctrine and Covenants
Ephesians 1:10,0.7138547936797359,israel in this last dispensation and fulness of times^ and,that in the dispensation of the fulness of times he,New Testament
Mosiah 4:26,0.7138149432039722,be baptized for the remission of sins of your sins,a remission of your sins from day to day that,Book of Mormon
Jacob 2:32,0.7138091988835309,i will burn them up saith the lord of hosts,people saith the lord of hosts,Book of Mormon
Doctrine and Covenants 53:3,0.7137358460582903,the laying on of hands for their is many of,by the laying on of hands,Doctrine and Covenants
Doctrine and Covenants 105:12,0.7137098354033293,are about to be poured out upon them and the,to be poured out upon them inasmuch as they are,Doctrine and Covenants
2 Nephi 20:27,0.7136707992796605,now free the yoke was off his neck and it,and his yoke from off thy neck and the yoke,Book of Mormon
Isaiah 10:27,0.7136707992796605,now free the yoke was off his neck and it,and his yoke from off thy neck and the yoke,Old Testament
3 Nephi 7:20,0.7136618028363177,to the people in the name of the lord in,of the people in the name of jesus,Book of Mormon
Doctrine and Covenants 33:15,0.7136533265485276,administered to her by the laying on of hands i,by the laying on of the hands and i will,Doctrine and Covenants
Doctrine and Covenants 33:15,0.7136533265485276,administered to her by the laying on of hands i,by the laying on of the hands and i will,Doctrine and Covenants
Isaiah 45:13,0.7136356945398552,saith the lord of hosts i the lord have spoken,reward saith the lord of hosts,Old Testament
Jeremiah 8:1,0.7136033115173109,from the bones our company roasted the bones and for,the bones of the prophets and the bones of the,Old Testament
Helaman 4:14,0.7135786589847004,but they would never repent of their sins their was,they did not repent of their sins,Book of Mormon
Mosiah 29:26,0.7135250677354914,unanimous voice of all the people not a voice is,by the voice of the people,Book of Mormon
Alma 2:3,0.7135250677354914,unanimous voice of all the people not a voice is,by the voice of the people,Book of Mormon
Acts 10:45,0.7135192315434261,of god and the gift of the holy ghost the,also was poured out the gift of the holy ghost,New Testament
Acts 10:45,0.7135192315434261,of god and the gift of the holy ghost the,also was poured out the gift of the holy ghost,New Testament
Doctrine and Covenants 136:42,0.7134917998447894,received my kingdom be diligent in keeping all my commandments,be diligent in keeping all my commandments lest judgments come,Doctrine and Covenants
1 Nephi 20:12,0.7134559940046246,and say i am judge i am col i am,i am he i am the first and i am also the last,Book of Mormon
Doctrine and Covenants 84:63,0.7134294196785337,i the lord say unto you mine apostles i also,say unto you for you are mine apostles even god's,Doctrine and Covenants
1 Nephi 16:38,0.7134254216814981,many things to us concerning these things which were interesting,us these things and he worketh many things by his,Book of Mormon
Doctrine and Covenants 135:3,0.713372611065255,god inspired by the power of god and the gift,by the gift and power of god and has been,Doctrine and Covenants
Numbers 18:12,0.7133008918885829,one of the best in the territory all of the,all the best of the oil and all the best,Old Testament
2 Nephi 33:5,0.7132802420418403,be by the spirit of the devil and if you,of the spirit of the devil,Book of Mormon
1 Kings 2:5,0.7132618207925006,to no man as thou knowest for thou knowest all,moreover thou knowest also what joab the son of zeruiah,Old Testament
Nehemiah 8:4,0.713252882675604,^e^ 4 ^p^ 5 ^t^ 1 ^d^ 3 and 6,stood mattithiah and shema and anaiah and urijah and hilkiah,Old Testament
Ezra 10:34,0.7132504599978823,we met with 3 sons and 2 sons in law,of the sons of bani maadai amram and uel,Old Testament
2 Chronicles 29:14,0.7132504599978823,we met with 3 sons and 2 sons in law,of the sons of jeduthun shemaiah and uzziel,Old Testament
Ezra 10:31,0.7132504599978823,we met with 3 sons and 2 sons in law,and of the sons of harim eliezer ishijah malchiah shemaiah shimeon,Old Testament
1 Corinthians 1:24,0.7132052897237521,of the power of god and spirit of god and,christ the power of god and the wisdom of god,New Testament
2 Kings 20:6,0.7131882784803161,my sake and for the sake of christ and the,this city for mine own sake and for my servant david's sake,Old Testament
Doctrine and Covenants 130:17,0.7131472705322605,for the coming of the son of man which is,i believe the coming of the son of man will,Doctrine and Covenants
1 Nephi 19:24,0.7131112607075404,"said unto the house of israel ""ye shall be unto",unto all the house of israel and liken them unto,Book of Mormon
Romans 12:17,0.7131105723801177,in the sight of angels and in the sight of,in the sight of all men,New Testament
Doctrine and Covenants 76:107,0.7130775344778539,the wrath and indignation of almighty god tuesday 2nd i,of the wrath of almighty god,Doctrine and Covenants
Acts 3:16,0.7130346054913982,presence and in the presence of others in 1832 the,soundness in the presence of you all,New Testament
Matthew 13:30,0.7130322987816219,let them grow with the wheat until the harvest may,let both grow together until the harvest and in the,New Testament
Genesis 49:25,0.7130211210389101,shall not be taken from thee i bless thee as,thee and by the almighty who shall bless thee with,Old Testament
1 Nephi 13:37,0.7129031523632928,the gift of the holy ghost and we seal you,gift and the power of the holy ghost and if,Book of Mormon
Luke 3:26,0.7128607265204105,the son and the son in the father in the,the son of joseph which was the son of juda,New Testament
Luke 3:24,0.7128607265204105,the son and the son in the father in the,the son of janna which was the son of joseph,New Testament
Deuteronomy 11:2,0.7128337187481553,in his hand and with an out stretched arm declared,his mighty hand and his stretched out arm,Old Testament
Doctrine and Covenants 20:77,0.7127655604233873,her father o god i ask thee in the name,o god the eternal father we ask thee in the,Doctrine and Covenants
Moroni 4:3,0.7127655604233873,her father o god i ask thee in the name,o god the eternal father we ask thee in the,Book of Mormon
Doctrine and Covenants 20:79,0.7127655604233873,her father o god i ask thee in the name,o god the eternal father we ask thee in the,Doctrine and Covenants
Moroni 5:2,0.7127655604233873,her father o god i ask thee in the name,o god the eternal father we ask thee in the,Book of Mormon
Deuteronomy 17:12,0.7127373301479837,a man will not have but one and i do,and the man that will do presumptuously and will not,Old Testament
Doctrine and Covenants 105:32,0.7126976594611095,the kingdom of our god and his christ and he,the kingdom of our god and his christ therefore let,Doctrine and Covenants
Jeremiah 2:4,0.7126805332964458,the son of man again hear ye the word of,hear ye the word of the lord o house of,Old Testament
Mosiah 3:12,0.71267360882777,understand and see that all is right wo wo wo,but wo wo unto him who knoweth that he rebelleth,Book of Mormon
Exodus 33:12,0.7126300110112447,thou hast spoken well i have all thou hast said,hast said i know thee by name and thou hast,Old Testament
Alma 50:22,0.7126263353145095,if we are faithful in keeping the commandments of god,and those who were faithful in keeping the commandments of,Book of Mormon
Matthew 15:14,0.7126227336278935,and lead people the blind may lead the blind and,and if the blind lead the blind both shall fall into the ditch,New Testament
Doctrine and Covenants 93:3,0.7125755323846343,his father and say o my father and his father,and that i am in the father and the father,Doctrine and Covenants
2 Kings 18:15,0.7125044199720505,in the [[house of the lord|house of the lord]] in,in the house of the lord and in the treasures of the king's house,Old Testament
Doctrine and Covenants 10:58,0.7125032566960502,light shineth in darkness and and again the third time,i am the light which shineth in darkness and the darkness comprehendeth it not,Doctrine and Covenants
Doctrine and Covenants 98:16,0.7124934216981728,seal the hearts of the children to the fathers malachi,the hearts of the fathers to the children,Doctrine and Covenants
Exodus 35:12,0.712402925162896,hour of silence the veil of the covering will be,and the veil of the covering,Old Testament
Joseph Smith--Matthew 1:41,0.7123600323706629,of the coming of the son of man and may,it shall be also at the coming of the son of man,Pearl of Great Price
Psalms 5:2,0.712358278182212,my people if the saints will hearken unto my voice,hearken unto the voice of my cry my king and,Old Testament
Joshua 22:18,0.7122948633812911,the god of israel with the congregation of the saints,wroth with the whole congregation of israel,Old Testament
Jeremiah 29:21,0.7122614813972735,of the coming of the son of man and may,of ahab the son of kolaiah and of zedekiah the,Old Testament
Alma 3:14,0.7122589117821152,and communed with them may the lord have mercy upon,that i may have mercy upon them,Book of Mormon
1 Chronicles 4:37,0.7122289888585892,i blessed my grand son the son of henry woodruff,and ziza the son of shiphi the son of allon,Old Testament
1 Chronicles 9:12,0.7122289888585892,i blessed my grand son the son of henry woodruff,the son of malchijah and maasiai the son of adiel,Old Testament
Nehemiah 11:5,0.7122289888585892,i blessed my grand son the son of henry woodruff,and maaseiah the son of baruch the son of colhozeh,Old Testament
Jeremiah 36:26,0.7122289888585892,i blessed my grand son the son of henry woodruff,seraiah the son of azriel and shelemiah the son of,Old Testament
1 Chronicles 9:8,0.7122289888585892,i blessed my grand son the son of henry woodruff,of uzzi the son of michri and meshullam the son,Old Testament
1 Chronicles 9:11,0.7122289888585892,i blessed my grand son the son of henry woodruff,and azariah the son of hilkiah the son of meshullam,Old Testament
Nehemiah 11:17,0.7122289888585892,i blessed my grand son the son of henry woodruff,and mattaniah the son of micha the son of zabdi,Old Testament
1 Chronicles 9:12,0.7122289888585892,i blessed my grand son the son of henry woodruff,and adaiah the son of jeroham the son of pashur,Old Testament
2 Samuel 23:20,0.7122289888585892,i blessed my grand son the son of henry woodruff,and benaiah the son of jehoiada the son of a,Old Testament
Jeremiah 40:9,0.7122289888585892,i blessed my grand son the son of henry woodruff,and gedaliah the son of ahikam the son of shaphan,Old Testament
2 Kings 25:23,0.7122289888585892,i blessed my grand son the son of henry woodruff,the son of nethaniah and johanan the son of careah,Old Testament
1 Chronicles 9:19,0.7122289888585892,i blessed my grand son the son of henry woodruff,and shallum the son of kore the son of ebiasaph,Old Testament
Nehemiah 3:11,0.7122289888585892,i blessed my grand son the son of henry woodruff,malchijah the son of harim and hashub the son of,Old Testament
Exodus 38:22,0.7122289888585892,i blessed my grand son the son of henry woodruff,and bezaleel the son of uri the son of hur,Old Testament
2 Nephi 33:1,0.7121783981756211,been moved upon by the power of the holy ghost,the power of the holy ghost the power of the,Book of Mormon
Genesis 46:7,0.7121682427612125,an elder have sons and daughters her sons should be,his sons and his sons' sons with him his daughters,Old Testament
Jeremiah 7:4,0.7121681915775847,in the temple of the lord tuesday 6 i met,the lord the temple of the lord the temple of the lord are these,Old Testament
Haggai 1:1,0.7121638987286083,the great temple of the lord a word unto the,the word of the lord by haggai the prophet unto,Old Testament
John 10:38,0.7121564231718427,i am in the father and the father in me,father is in me and i in him,New Testament
Matthew 18:19,0.7121221015715923,that where two or three agree as touching any thing,shall agree on earth as touching any thing that they,New Testament
Genesis 9:5,0.7120391178425858,hand of god is it required at the hand of,and at the hand of man at the hand of,Old Testament
Luke 13:28,0.7120332249746715,abraham isaac and jacob and all the holy prophets and,shall see abraham and isaac and jacob and all the,New Testament
Haggai 2:9,0.711998847689623,saith the lord of hosts i the lord have spoken,of the former saith the lord of hosts and in,Old Testament
Doctrine and Covenants 68:18,0.7119619959688167,to be men who hold the priesthood and keys of,hold the keys of this priesthood except he be a,Doctrine and Covenants
Exodus 28:1,0.7119245461777732,as was aaron and aaron received his call by revelation,aaron nadab and abihu eleazar and ithamar aaron's sons,Old Testament
Doctrine and Covenants 57:1,0.7119234785968109,upon the gathering of the saints i also met with,for the gathering of the saints,Doctrine and Covenants
Moses 3:11,0.7119075528038918,the priesthood in the name of the lord god which,and i the lord god called the name of the,Pearl of Great Price
John 3:19,0.7118989702179973,rather than the light because their deeds are evil 12,the world and men loved darkness rather than light because their deeds were evil,New Testament
Doctrine and Covenants 76:112,0.7118914121403612,and christ and celestial saints dwell they cannot come worlds,where god and christ dwell they cannot come worlds without end,Doctrine and Covenants
Mormon 1:8,0.7118705434906027,the lamanites the question has been asked will the lamanites,lamanites and the lemuelites and the ishmaelites,Book of Mormon
Joseph Smith--Matthew 1:41,0.7118697378985076,the coming of the son of man i the lord,it shall be also at the coming of the son of man,Pearl of Great Price
Doctrine and Covenants 105:14,0.7118671923586288,battles of zion for i will fight your battles nevertheless,fight the battles of zion for as i said in,Doctrine and Covenants
Matthew 23:39,0.7118279302750311,in the name of the lord that they would see,in the name of the lord,New Testament
1 Chronicles 16:2,0.7118279302750311,in the name of the lord that they would see,in the name of the lord,Old Testament
Moses 1:1,0.7118154241530541,will find in the words of god which he spake,the words of god which he spake unto moses at,Pearl of Great Price
Nehemiah 7:62,0.7117985163898692,children and the hearts of the children to their fathers,the children of delaiah the children of tobiah the children,Old Testament
Nehemiah 7:62,0.7117985163898692,children and the hearts of the children to their fathers,the children of delaiah the children of tobiah the children,Old Testament
Nehemiah 7:45,0.7117985163898692,children and the hearts of the children to their fathers,the children of talmon the children of akkub the children,Old Testament
Ezra 2:60,0.7117985163898692,children and the hearts of the children to their fathers,the children of delaiah the children of tobiah the children,Old Testament
Ezra 2:60,0.7117985163898692,children and the hearts of the children to their fathers,the children of delaiah the children of tobiah the children,Old Testament
Nehemiah 7:59,0.7117985163898692,children and the hearts of the children to their fathers,the children of shephatiah the children of hattil the children,Old Testament
Ezra 2:57,0.7117985163898692,children and the hearts of the children to their fathers,the children of shephatiah the children of hattil the children,Old Testament
Nehemiah 7:45,0.7117985163898692,children and the hearts of the children to their fathers,the children of talmon the children of akkub the children,Old Testament
Ezra 2:57,0.7117985163898692,children and the hearts of the children to their fathers,the children of shephatiah the children of hattil the children,Old Testament
Nehemiah 7:59,0.7117985163898692,children and the hearts of the children to their fathers,the children of shephatiah the children of hattil the children,Old Testament
Mark 13:27,0.7117510105170516,part of the day in prayer and a part of,part of the earth to the uttermost part of heaven,New Testament
Ezekiel 48:19,0.7117462607252643,of the everlasting god upon the tribes of israel and,of all the tribes of israel,Old Testament
Psalms 104:35,0.7117037457654023,and trust in him praise the lord o my soul,o my soul praise ye the lord,Old Testament
Exodus 14:22,0.7117027671445222,he staid in the midst of the children of israel,and the children of israel went into the midst of,Old Testament
1 Kings 22:15,0.711695376415214,the house the king then said i am your king,so he came to the king and the king said,Old Testament
Job 30:6,0.7116812530196106,with earth except the train the rocks and earth was,of the earth and in the rocks,Old Testament
Nehemiah 7:45,0.7116657847590165,children and the hearts of the children unto the fathers,the children of talmon the children of akkub the children,Old Testament
Ezra 2:57,0.7116657847590165,children and the hearts of the children unto the fathers,the children of shephatiah the children of hattil the children,Old Testament
Nehemiah 7:59,0.7116657847590165,children and the hearts of the children unto the fathers,the children of shephatiah the children of hattil the children,Old Testament
Nehemiah 7:62,0.7116657847590165,children and the hearts of the children unto the fathers,the children of delaiah the children of tobiah the children,Old Testament
Ezra 2:60,0.7116657847590165,children and the hearts of the children unto the fathers,the children of delaiah the children of tobiah the children,Old Testament
1 Timothy 6:15,0.7116480053266486,king of kings and lord of lords to rule over,blessed and only potentate the king of kings and lord of lords,New Testament
Nehemiah 11:12,0.7116094939817946,the son and the son in the father in the,the son of zechariah the son of pashur the son of malchiah,Old Testament
1 Chronicles 6:42,0.7116094939817946,the son and the son in the father in the,the son of ethan the son of zimmah the son of shimei,Old Testament
Doctrine and Covenants 102:26,0.7115999224635476,here office of the first presidency of the church of,of the seat of the first presidency of the church,Doctrine and Covenants
Matthew 23:39,0.7115432926660963,other in the name of the lord by the laying,in the name of the lord,New Testament
1 Chronicles 16:2,0.7115432926660963,other in the name of the lord by the laying,in the name of the lord,Old Testament
Doctrine and Covenants 133:52,0.7114390299733405,his great goodness and loving kindness towards me and my,goodness and according to his loving kindness forever and ever,Doctrine and Covenants
Matthew 23:39,0.7114194285636144,i bless you in the name of the lord with,in the name of the lord,New Testament
1 Chronicles 16:2,0.7114194285636144,i bless you in the name of the lord with,in the name of the lord,Old Testament
1 Chronicles 12:23,0.7113426970079164,the great temple of the lord a word unto the,to the word of the lord,Old Testament
Moses 7:10,0.7113396286312245,lest i come and smite the whole earth with a,and say unto themrepent lest i come out and smite,Pearl of Great Price
Jeremiah 9:20,0.7113331214386015,of man again hear ye the word of the lord,yet hear the word of the lord o ye women,Old Testament
Doctrine and Covenants 97:7,0.7112816771636914,of the tree and evry tree that bringeth not forth,and every tree that bringeth not forth good fruit shall,Doctrine and Covenants
Doctrine and Covenants 109:17,0.7112094988734871,friends in the name of the lord that you may,may be in the name of the lord,Doctrine and Covenants
Jeremiah 16:14,0.7112058959635467,ot took the children of israel out of egypt into,up the children of israel out of the land of egypt,Old Testament
1 John 3:4,0.7111672120595678,is written that sin is a transgression of the law,whosoever committeth sin transgresseth also the law for sin is the transgression of the law,New Testament
Doctrine and Covenants 45:12,0.7111062747873822,as a nation because of there wickedness and abominations and,they found it not because of wickedness and abominations,Doctrine and Covenants
Luke 22:40,0.711083442879025,that we enter not into temptation i spent the evening,them pray that ye enter not into temptation,New Testament
Leviticus 25:44,0.7110477200768179,temple of the lord thy god thou shalt teach thy,both thy bondmen and thy bondmaids which thou shalt have,Old Testament
Doctrine and Covenants 128:18,0.7110440552718674,of the dispensation of times a dispensation to meet the,this the dispensation of the fulness of times,Doctrine and Covenants
Hebrews 6:6,0.7109323192107475,they shall fall away it is impossible to renew them,if they shall fall away to renew them again unto,New Testament
Alma 44:24,0.7109003190122393,years it was in the eighteenth year of the reign,and thus ended the eighteenth year of the reign of,Book of Mormon
Mosiah 11:5,0.7108761183236972,lifted up in the pride of our hearts and not,stead such as were lifted up in the pride of their hearts,Book of Mormon
1 Chronicles 6:21,0.7108507753722936,his son wilford smith woodruff and his son charles wilford,joah his son iddo his son zerah his son jeaterai his son,Old Testament
Acts 20:38,0.7108483188218034,but few of the words which he spake he said,sorrowing most of all for the words which he spake,New Testament
Mormon 9:29,0.7108443207871591,of my name and of the gospel of jesus christ,in the name of jesus christ the son of the,Book of Mormon
Doctrine and Covenants 55:1,0.7108290210056073,son thus saith the lord god unto thee my servant,behold thus saith the lord unto you my servant william,Doctrine and Covenants
Romans 15:13,0.7107948775077277,power of the holy ghost now any of the rest,through the power of the holy ghost,New Testament
Doctrine and Covenants 132:63,0.7107139549395491,to marry and multiply and replenish the earth this is,unto him to multiply and replenish the earth according to,Doctrine and Covenants
